Tweet,User,User_ID,Geo,HashTag,Date
599,The Miami Beach @TimeOutMarket will be opening their doors on May 9! Read more about what you can expect to eat & drink via @Miamicom: https://www.miamiherald.com/miami-com/article229602929.html … #ExperienceMiamiBeach,MiamiBeachNews,17931773,,#ExperienceMiamiBeach,Wed Apr 24 14:22:00 +0000 2019
600,"Missed out on our 1st HIIT the Market bootcamp? We're bringing you a FREE HIIT workout every Saturday at Lummus Park! Get your sweat on then enjoy 20% off your brunch at participating restaurants on Ocean Drive, RSVP today: https://www.eventbrite.com/e/hiit-the-market-tickets-60669824077 … #ExperienceMiamiBeach #RoyaFitpic.twitter.com/V9enwHsWmV",MiamiBeachNews,17931773,,#ExperienceMiamiBeach #RoyaFitpic,Wed Apr 24 13:36:04 +0000 2019
601,A lot of amazing exhibits & live entertainment for everyone to enjoy during our monthly Culture Crawl happening tonight! #MBArtsandCulturehttps://twitter.com/MickySteinberg/status/1121018715947044864 …,MiamiBeachNews,17931773,,#MBArtsandCulturehttps,Wed Apr 24 12:43:20 +0000 2019
602,"Don’t forget your four R’s: Refuse, Reduce, Reuse, and Recycle! There is always a way to make a difference #MBRisingAbove http://www.mbrisingabove.com/recycle pic.twitter.com/57X8uXp78P",MiamiBeachNews,17931773,,#MBRisingAbove,Tue Apr 23 17:25:56 +0000 2019
603,"#MBParks is getting ready for summer camp & you should too! Registration has opened, sign-up your little ones today: http://register.miamibeachparks.com pic.twitter.com/JSqmJadWSE",MiamiBeachNews,17931773,,#MBParks,Tue Apr 23 14:01:22 +0000 2019
604,so ready for our Culture Crawl #MBArtsAndCulturepic.twitter.com/F5wXcbmdxW,MiamiBeachNews,17931773,,#MBArtsAndCulturepic,Mon Apr 22 23:15:42 +0000 2019
605,. @DwightSchrute_ understands the importance of recycling! #EarthDay Learn how you can be a ‘Recyclops’ by visiting http://mbrisingabove.com/recycle #MBRisingAbove pic.twitter.com/Emjxc9tCEj,MiamiBeachNews,17931773,,#EarthDay #MBRisingAbove,Mon Apr 22 21:01:43 +0000 2019
606,"Environmental Dir. Betsy Wheaton joined in yesterday w/ one of our #PlasticFreeMB partners, the @EDITIONHotels, for their “Breaking up with Plastics” panel discussion on how we can make small changes to reduce our reliance on single-use plastics & reduce our consumption #EarthDaypic.twitter.com/bo58oSNmxJ",MiamiBeachNews,17931773,,#PlasticFreeMB #EarthDaypic,Mon Apr 22 19:11:01 +0000 2019
607,days away from our monthly Culture Crawl! Map out your evening by checking out the participating venues & activation's: http://www.mbartsandculture.org/event/miami-beach-culture-crawl/ … #MBArtsAndCulturepic.twitter.com/LqIurhk8MV,MiamiBeachNews,17931773,,#MBArtsAndCulturepic,Mon Apr 22 17:02:09 +0000 2019
608,"We’ve partnered with @WeWork to host a workshop to help you navigate city services for those interested in opening a business in Miami Beach! Monday, April 22 | 4 PM - 6 PM WeWork South of Fifth RSVP is still open: ed@miamibeachfl.govpic.twitter.com/Ajr98fvcmt",MiamiBeachNews,17931773,,,Mon Apr 22 15:20:21 +0000 2019
609,Happy #EarthDay Today we ask you to take one step forward in going #PlasticFreeMB with us! Visit http://www.plasticfreemb.com to learn how pic.twitter.com/w9mOXOxeZb,MiamiBeachNews,17931773,,#EarthDay #PlasticFreeMB,Mon Apr 22 14:37:06 +0000 2019
610,#TRAFFIC Accident on the MacArthur Cswy EB before Watson has left lane blocked. Heavy congestion from Biscayne back to I-95.,MiamiBeachNews,17931773,,#TRAFFIC,Mon Apr 22 14:08:16 +0000 2019
611,Spending this beautiful #EasterSunday in our favorite spot. Happy Easter to all pic.twitter.com/g5kxyYkO7H,MiamiBeachNews,17931773,,#EasterSunday,Sun Apr 21 15:18:25 +0000 2019
612,"We earned our brunch this morning with the first #RoyaFit HIIT workout at Lummus Park! & now participants can enjoy 20% off at Ocean Drive restaurants Missed out today? We’ll be back each Saturday, keep an eye out for updates #ExperienceMiamiBeachpic.twitter.com/TdmLD71wM9",MiamiBeachNews,17931773,,#RoyaFit #ExperienceMiamiBeachpic,Sat Apr 20 15:37:06 +0000 2019
613,Getting ready to get in a good sweat with #RoyaFit at Lummus Park. Boot camp participants can enjoy 20% off at select restaurants on Ocean Drive with this wristband & at all Starbucks locations in South Beach too! #ExperienceMiamiBeachpic.twitter.com/HCEeMAPIv0,MiamiBeachNews,17931773,,#RoyaFit #ExperienceMiamiBeachpic,Sat Apr 20 13:50:36 +0000 2019
614,"View the latest message from @MyFDOT_Miami regarding updates beginning Monday, April 22 at 10 p.m., for the ongoing MacArthur Causeway project. Click here for more information: https://conta.cc/2XoZz4o pic.twitter.com/qBMuyVIgKj",MiamiBeachNews,17931773,,,Fri Apr 19 22:47:54 +0000 2019
615,Purchase your tickets today to catch 'Purple Rain' at the @FillmoreMB & enjoy Prince on their killer sound system: http://www.fillmoremb.com//EventDetail?tmeventid=0D00566ED059D622&offerid=100432 … #MBArtsAndCulutre pic.twitter.com/IyyDIVT8Al,MiamiBeachNews,17931773,,#MBArtsAndCulutre,Fri Apr 19 18:03:07 +0000 2019
616,next week on April 24! And again the last Wednesday of each month #MBArtsAndCulture,MiamiBeachNews,17931773,,#MBArtsAndCulture,Fri Apr 19 16:29:03 +0000 2019
617,"HIIT Lummus Park tomorrow with a free full body workout, then make your way to Ocean Drive where bootcamp participants can enjoy 20% off at select restaurants for brunch! RSVP: https://www.eventbrite.com/e/hiit-the-market-tickets-60446773928 … #ExperienceMiamiBeach #RoyaFit pic.twitter.com/UUAEBzSjmG",MiamiBeachNews,17931773,,#ExperienceMiamiBeach #RoyaFit,Fri Apr 19 15:04:36 +0000 2019
618,"If you've ever visited the @ColonyTheatreMB, you might have been lucky enough to catch a production put on by the 'Miami New Drama'. Learn more about this group via @AmericanTheatre: https://www.americantheatre.org/2019/04/17/whats-miami-is-yours/?fbclid=IwAR2pjqUTitnj7qOgf7ZepN348kR_Kf9cW9lwfSMaqTDr9DOLFB8i2NNQQCY … #MBArtsAndCulture",MiamiBeachNews,17931773,,#MBArtsAndCulture,Fri Apr 19 14:18:57 +0000 2019
619,"From sushi to Cuban cuisine, view the hottest new restaurants in the area via the @nypost: https://nypost.com/2019/04/18/miamis-best-new-restaurants-from-sushi-to-cuban-cuisine/ … #ExperienceMiamiBeach",MiamiBeachNews,17931773,,#ExperienceMiamiBeach,Fri Apr 19 13:58:47 +0000 2019
620,Commissioner @MichaelGongora to honor Isabela Perdomo for being an Environmental Ambassador — Current Sophmore at MAST @@FIU High School #MBRisingAbovepic.twitter.com/SEsY1LdK0Q,MiamiBeachNews,17931773,,#MBRisingAbovepic,Fri Apr 19 13:35:12 +0000 2019
621,The City of Miami Beach Partners with @WeWork — Providing Opportunity for Growth with Discounts and Success with Capacity Buildingpic.twitter.com/JcXyFr2Ro3,MiamiBeachNews,17931773,,,Fri Apr 19 13:32:40 +0000 2019
622,sign up to receive our traffic text alerts by texting MBTraffic to 888777,MiamiBeachNews,17931773,,,Fri Apr 19 12:54:44 +0000 2019
623,"Due to an accident with injuries, EB traffic is shut down on 5th St/Michigan and Jefferson Ave re-routed NB.",MiamiBeachNews,17931773,,,Fri Apr 19 10:49:06 +0000 2019
624,Our favorite kind of vibes #ExperienceMiamiBeachhttps://twitter.com/Blondy_Brunet/status/1118987141835558945 …,MiamiBeachNews,17931773,,#ExperienceMiamiBeachhttps,Thu Apr 18 21:33:19 +0000 2019
625,"Calling all momma's: #MBParks has partnered with @Publix & Mind Body Social to bring you a series of free events for 'Mother's May Wellness'! From prenatal yoga to Mommy & Me Zumba, we're getting fit & healthy together: https://mbs.events/publix/ #MayWellness pic.twitter.com/ebXCcSgHRy",MiamiBeachNews,17931773,,#MBParks #MayWellness,Thu Apr 18 17:54:21 +0000 2019
626,We're always in need of a good beach day #ExperienceMiamiBeachhttps://twitter.com/VISITFLORIDA/status/1118874351187759105 …,MiamiBeachNews,17931773,,#ExperienceMiamiBeachhttps,Thu Apr 18 15:46:08 +0000 2019
627,"So nice, we did it twice! Join us on Wednesday, April 24 as we open the doors to 11 of Miami Beach's hottest cultural institutions for our Culture Crawl: http://www.mbartsandculture.org/event/miami-beach-culture-crawl/ … #MBArtsAndCulturepic.twitter.com/mhAujoSBU0",MiamiBeachNews,17931773,,#MBArtsAndCulturepic,Thu Apr 18 15:08:01 +0000 2019
628,Start your Saturday w/ a FREE full body HIIT workout at Lummus Park! Participants can enjoy 20% off at select Ocean Drive restaurants for brunch -- don't forget our Artisan Market also takes place on Saturday from 10AM - 4PM. RSVP: https://www.eventbrite.com/e/hiit-the-market-tickets-60446773928 … #ExperienceMiamiBeachpic.twitter.com/HFOGcQKb1F,MiamiBeachNews,17931773,,#ExperienceMiamiBeachpic,Thu Apr 18 14:41:17 +0000 2019
629,". @MiamiandBeaches is developing their next 5-year strategic tourism plan & wants you to join in & share your thoughts. Thursday, May 2 | 6 PM - 8 PM Miami Beach Botanical Garden | Banyan Room 2000 Convention Center Dr Register for free here: http://miamifl.simpleviewcrm.com/webapi/rsvp/v2/?action=registrationForm&eventid=870&sessionuuid= …pic.twitter.com/SOH4LdqNsS",MiamiBeachNews,17931773,,,Thu Apr 18 13:53:33 +0000 2019
630,Interested in opening a business in Miami Beach? We’ve partnered with @WeWork to host a workshop to help you navigate city services! MON 4/22 | 4 PM - 6 PM WeWork South of Fifth RSVP: ed@miamibeachfl.govpic.twitter.com/Wuv5G5mEnS,MiamiBeachNews,17931773,,,Wed Apr 17 21:26:41 +0000 2019
631,City of Miami Beach Named 2019 Healthiest Employer Honoree — Presented by @FLBlue and the @SFBJNews pic.twitter.com/Ks3ZiAia2d,MiamiBeachNews,17931773,,,Wed Apr 17 20:22:43 +0000 2019
632,"Reminder, tonight at 6 PM we’ll be hosting our WE-Lab Workshop, where participants will receive a FREE water & energy saving toolkit (valued at $50) #MBRisingAbove RSVP now: http://we-lab.net/workshop/ pic.twitter.com/BXFSHbROuS",MiamiBeachNews,17931773,,#MBRisingAbove,Wed Apr 17 18:53:36 +0000 2019
633,Let our weekly Arts & Culture guide help you plan out your social calendar this week: https://conta.cc/2XnoipT #MBArtsAndCulture pic.twitter.com/cTC2902Ycv,MiamiBeachNews,17931773,,#MBArtsAndCulture,Wed Apr 17 16:33:04 +0000 2019
634,"With over 65 cigarette ashcans installed throughout the city, we’ve collected over 17,400 butts in just 2 months! That’s 17,400 cigarette butts that is not being littered in our streets or our beaches #MBRisingAbovepic.twitter.com/tYbYXb3VLb",MiamiBeachNews,17931773,,#MBRisingAbovepic,Wed Apr 17 15:59:10 +0000 2019
635,Where to brunch in Miami Beach for Easter via @TimeOutMiami https://www.timeout.com/miami/news/where-to-brunch-in-miami-on-easter-041619 … #ExperienceMiamiBeach,MiamiBeachNews,17931773,,#ExperienceMiamiBeach,Wed Apr 17 15:19:37 +0000 2019
636,"On Your Mark, Get Set, G.O! — City of Miami Beach General Obligation Bonds Hit the Wall Street Market #GOMB2018pic.twitter.com/uqiCySl3V3",MiamiBeachNews,17931773,,#GOMB2018pic,Tue Apr 16 21:49:05 +0000 2019
637,DASH Student Design to Launch Miami Beach Pilot Parklet — Winning Design to Be Featured on 41 Street Corridorpic.twitter.com/OdAq3s8mCC,MiamiBeachNews,17931773,,,Tue Apr 16 18:06:13 +0000 2019
638,"Miami Beach of course, it’s the fun & sun capital of the world #ExperienceMiamiBeachhttps://twitter.com/VISITFLORIDA/status/1118197361363361793 …",MiamiBeachNews,17931773,,#ExperienceMiamiBeachhttps,Tue Apr 16 17:04:04 +0000 2019
639,"Thank you for sharing this with us, we've sent this to the appropriate city personnel. Also, we recommend you download our eGov app which allows you to submit any issues you may have directly to the dept! https://www.miamibeachfl.gov/city-hall/information-technology/applications-division/mobile-apps/ …",MiamiBeachNews,17931773,,,Tue Apr 16 15:44:31 +0000 2019
640,Explore the relationship between water & energy use behaviors & learn to implement sustainability right at home during our WE-Lab Workshop on 4/17! Participants will receive a FREE water & energy saving toolkit (valued at $50) #MBRisingAbove RSVP today: http://we-lab.net/workshop/ pic.twitter.com/6zJrXs0w1b,MiamiBeachNews,17931773,,#MBRisingAbove,Tue Apr 16 15:17:09 +0000 2019
641,#Traffic Advisory: Please expect congestion around the 5 Street corridor as crews finish cleaning up from the 600 Alton implosion.,MiamiBeachNews,17931773,,#Traffic,Tue Apr 16 14:27:40 +0000 2019
642,"Planned implosion of the 600 Alton building right off the the MacArthur Cswy, expect some delays.",MiamiBeachNews,17931773,,,Tue Apr 16 14:24:35 +0000 2019
643,Sea turtle season officially began April 1 in Miami Beach! Check out http://mbrisingabove.com/seaturtles to learn more about how you can protect our marine friends #MBShareTheShorepic.twitter.com/8QJYOjzOmt,MiamiBeachNews,17931773,,#MBShareTheShorepic,Mon Apr 15 19:20:06 +0000 2019
644,"It's never too early to prepare for #hurricaneseason. Learn the proper skills that can help you, your family & your neighbors in times of emergencies & disasters through @FEMA's Community Emergency Response Team (CERT) training. E-mail DEM@miamibeachfl.gov to register today!pic.twitter.com/JovVa9XdLe",MiamiBeachNews,17931773,,#hurricaneseason,Mon Apr 15 18:27:46 +0000 2019
645,Thank you for working to #KeepMBClean!https://twitter.com/EdenRocMia/status/1117835796646645762 …,MiamiBeachNews,17931773,,#KeepMBClean,Mon Apr 15 17:04:13 +0000 2019
646,Stay connected with Miami Beach! Text MBAlert and MBTraffic to 888777 to get updates sent right to your phone & sign-up to receive city emails: https://visitor.r20.constantcontact.com/manage/optin?v=001G3gQF_El_4o1UEbguheB5mmzfG7onDdMWh1j1h9a2GsYhO3lonlhDSUJFN_o5P9wC0vRAaCeLeZPSQUtU24d15ThoaXBqAVUR9PeN6M6eUc%3D … pic.twitter.com/R3fFvGKdKu,MiamiBeachNews,17931773,,,Mon Apr 15 16:16:28 +0000 2019
647,At the Normandy Fountain in North Beach!,MiamiBeachNews,17931773,,,Mon Apr 15 15:25:16 +0000 2019
648,"We’re transforming the Normandy Fountain into a soulful brunch on Sunday, April 28 Sit down to some of Miami Beach’s favorite breakfast eats boasting Brunch classics, artisan vendors, kid’s activities & more: https://www.eventbrite.com/e/motown-brunch-ft-yoli-mayor-tickets-59555178141?fbclid=IwAR3tKn7E2QzhxsoRg42LjmqRiXlsqORuDrDcJbqN7lbHKefHiwQoNDSk29g … #KnowNoBepic.twitter.com/gI59I2OQ1x",MiamiBeachNews,17931773,,#KnowNoBepic,Mon Apr 15 15:22:10 +0000 2019
649,City of Miami Beach Launches a Free High School Technical Training Program. Students can apply here: https://www.miamibeachfl.gov/technicaltraining/ …pic.twitter.com/Lw8PKLDVzT,MiamiBeachNews,17931773,,,Mon Apr 15 14:35:02 +0000 2019
650,We’re getting summer ready & you should too by checking out #MBParks Recreation Review: https://issuu.com/cityofmiamibeach/docs/2019_summer_camp_rr_?e=30429945/68907289 … pic.twitter.com/F3fVhpXSE3,MiamiBeachNews,17931773,,#MBParks,Mon Apr 15 14:24:34 +0000 2019
651,"#ICYMI Notice from the Contractor: Implosion of 600 Alton is taking place tomorrow, April 16. View information here: https://myemail.constantcontact.com/South-Shore-Hospital-Implosion---TUE-4-16.html?soid=1011085968389&aid=sZiROGGdaWY …pic.twitter.com/nSTeDI9XOs",MiamiBeachNews,17931773,,#ICYMI,Mon Apr 15 13:54:19 +0000 2019
652,Congratulations to all participants of the #SouthBeachTri!https://twitter.com/frankieruiz/status/1117481600051240960 …,MiamiBeachNews,17931773,,#SouthBeachTri,Mon Apr 15 13:30:58 +0000 2019
653,"Thank you for bringing this to our attention, we have shared this with the appropriate city personnel",MiamiBeachNews,17931773,,,Mon Apr 15 13:04:41 +0000 2019
654,"View the latest message from @MyFDOT_Miami regarding updates beginning tonight, April 14 at 8 p.m., for the ongoing MacArthur Causeway project: https://conta.cc/2KCI8fj pic.twitter.com/CULRLs0ub5",MiamiBeachNews,17931773,,,Sun Apr 14 16:39:35 +0000 2019
655,"#TRAFFIC: the South Beach Triathlon will race through Miami Beach tomorrow, check out traffic information here: https://conta.cc/2KpZWKv pic.twitter.com/N4woQuXM83",MiamiBeachNews,17931773,,#TRAFFIC,Sat Apr 13 20:27:22 +0000 2019
656,"Beautiful morning at North Shore for #MBParks Annual EGGSTRAVAGANZA! Don’t forget to stop by the Environment & Sustainability table, they’re giving away mini succulents & talking about the importance of having plants at home #MBRisingAbovepic.twitter.com/UGmb4QaOdi",MiamiBeachNews,17931773,,#MBParks #MBRisingAbovepic,Sat Apr 13 16:28:41 +0000 2019
657,Doing our part to #KeepMBClean during #Baynanza right off of the Julia Tuttle Causeway pic.twitter.com/vUqLjXu9V8,MiamiBeachNews,17931773,,#KeepMBClean #Baynanza,Sat Apr 13 16:17:19 +0000 2019
658,Girl Scouts getting ready to head out to Monument Island for the 37th Annual #Baynanza! #KeepMBCleanpic.twitter.com/xb71X83gbt,MiamiBeachNews,17931773,,#Baynanza #KeepMBCleanpic,Sat Apr 13 15:06:10 +0000 2019
659,' @TheMiamiBeachCC unveils beautiful new art installations' via @OceanDriveMag https://oceandrive.com/miami-beach-convention-center-new-art-installations … #MBArtsAndCulturepic.twitter.com/yqfX88dZX3,MiamiBeachNews,17931773,,#MBArtsAndCulturepic,Fri Apr 12 20:13:43 +0000 2019
660,Stay in the know with Miami Beach with our bi-weekly newsletter: https://conta.cc/2UyOEIj pic.twitter.com/KCzRkNOhiT,MiamiBeachNews,17931773,,,Fri Apr 12 18:10:48 +0000 2019
661,"Reminder: the South Beach Triathlon will be racing through Miami Beach this Sunday, April 14: http://conta.cc/2Kqi7Qk pic.twitter.com/LDhCtCxchD",MiamiBeachNews,17931773,,,Fri Apr 12 16:08:11 +0000 2019
662,"Notice from the Contractor: Implosion of 600 Alton is taking place on Tuesday, April 16. View information here: https://conta.cc/2KzdNOz pic.twitter.com/djByHxIZDQ",MiamiBeachNews,17931773,,,Fri Apr 12 14:43:40 +0000 2019
663,Date night idea! #MBArtsAndCulturehttps://twitter.com/TheMiamiBeachCC/status/1116708114378711040 …,MiamiBeachNews,17931773,,#MBArtsAndCulturehttps,Fri Apr 12 14:26:14 +0000 2019
664,Thanks for joining us! #PlasticFreeMB,MiamiBeachNews,17931773,,#PlasticFreeMB,Fri Apr 12 13:30:34 +0000 2019
665,Thank you for joining us today! #PlasticFreeMBhttps://twitter.com/Aranciata15/status/1116470982598959106 …,MiamiBeachNews,17931773,,#PlasticFreeMBhttps,Thu Apr 11 23:04:07 +0000 2019
666,It’s not about getting rid of one single-use plastic & replacing it with a reusable one. We need to visualize & embrace how the world is changing & get comfortable with it. @1Hotels is one of our founding businesses leading the way to be #PlasticFreeMB!pic.twitter.com/L7CpcTDWgT – at 1 Hotel & Homes South Beach,MiamiBeachNews,17931773,,#PlasticFreeMB,Thu Apr 11 22:48:30 +0000 2019
667,“We have to be the most environmentally-conscious city in the world.” - @MayorDanGelber Going plastic-free is no easy task but we’re here to help businesses & individuals at home take that first step in joining us to be #PlasticFreeMB! Visit http://www.plasticfreemb.com todaypic.twitter.com/C4UDRdWZxH – at 1 Hotel & Homes South Beach,MiamiBeachNews,17931773,,#PlasticFreeMB,Thu Apr 11 22:29:57 +0000 2019
668,"Summer camp registration is open for Miami Beach residents, check out our recreation review before signing up your little ones: https://issuu.com/cityofmiamibeach/docs/2019_summer_camp_rr_?e=30429945/68907289 … #MBParkspic.twitter.com/69Xd25FdiA",MiamiBeachNews,17931773,,#MBParkspic,Thu Apr 11 16:26:21 +0000 2019
669,"' @TheMiamiBeachCC's makeover is a stunner, so naturally, the public art incorporated into and around the renovation has to equally wow the public.' Read all about it via the @MiamiNewTimes: https://www.miaminewtimes.com/arts/miami-beach-convention-centers-public-art-cost-miami-beach-taxpayers-7-million-11138523 … #MBArtsAndCulture",MiamiBeachNews,17931773,,#MBArtsAndCulture,Thu Apr 11 14:23:46 +0000 2019
670,. @1Hotels is 1 of over 100 Miami Beach businesses who have taken the pledge to go plastic-free! We'll be celebrating with them tonight & our other partners for our official launch of #PlasticFreeMB http://www.plasticfreemb.com pic.twitter.com/hy2guBDyDV,MiamiBeachNews,17931773,,#PlasticFreeMB,Thu Apr 11 13:59:19 +0000 2019
671,Sign-up today & #KeepMBClean!https://twitter.com/MiamiDadeCounty/status/1116008047288160258 …,MiamiBeachNews,17931773,,#KeepMBClean,Wed Apr 10 20:25:57 +0000 2019
672,"#TRAFFIC: View information for the South Beach Triathlon racing through Miami Beach this Sunday, April 14: https://conta.cc/2Kqi7Qk pic.twitter.com/QY6xoGJcSj",MiamiBeachNews,17931773,,#TRAFFIC,Wed Apr 10 19:57:54 +0000 2019
673,Sign-up for Miami Beach's voluntary 911 special needs registry today: http://www.mbspecialneeds.com pic.twitter.com/pK2nVHVHRf,MiamiBeachNews,17931773,,,Wed Apr 10 18:34:31 +0000 2019
674,"From exhibits at @TheBassMoA to the opera at @ColonyTheatreMB, your weekly #MBArtsAndCulture guide is here: https://conta.cc/2Ky73ke pic.twitter.com/QteakNweRA",MiamiBeachNews,17931773,,#MBArtsAndCulture,Wed Apr 10 17:13:12 +0000 2019
675,Start receiving our traffic updates by texting MBTraffic to 888777 & sign-up for our city emails today: https://visitor.r20.constantcontact.com/manage/optin?v=001G3gQF_El_4o1UEbguheB5mmzfG7onDdMWh1j1h9a2GsYhO3lonlhDSUJFN_o5P9wC0vRAaCeLeZPSQUtU24d15ThoaXBqAVUR9PeN6M6eUc%3D …pic.twitter.com/zBEJyeRfRz,MiamiBeachNews,17931773,,,Wed Apr 10 15:35:22 +0000 2019
676,Are you watching today’s Commission meeting? Tune into MBTV (Ch.77) or stream online: https://www.miamibeachfl.gov/government/mbtv/ … #GovernmentInActionpic.twitter.com/KIYLqU2gJz,MiamiBeachNews,17931773,,#GovernmentInActionpic,Wed Apr 10 13:33:02 +0000 2019
677,It’s forever Wade County @DwyaneWade #L3GACY #OneLastDancepic.twitter.com/oZYuN32xIJ,MiamiBeachNews,17931773,,#L3GACY #OneLastDancepic,Wed Apr 10 02:08:11 +0000 2019
678,Are you expecting? Enjoy FREE prenatal yoga every Wednesday at Muss Park in partnership with #MBParks & NoBe Yoga pic.twitter.com/EAb4ae1pQb,MiamiBeachNews,17931773,,#MBParks,Tue Apr 09 20:07:25 +0000 2019
679,Yes! #KeepMBClean #PlasticFreeMBhttps://twitter.com/EdenRocMia/status/1115687311948308481 …,MiamiBeachNews,17931773,,#KeepMBClean #PlasticFreeMBhttps,Tue Apr 09 18:51:24 +0000 2019
680,"We can't hold back our tears, you are a legend @DwyaneWade #WadeCounty #OneLastDancehttps://twitter.com/budweiserusa/status/1115600248322383873 …",MiamiBeachNews,17931773,,#WadeCounty #OneLastDancehttps,Tue Apr 09 15:45:45 +0000 2019
681,"Our artist in residence, Misael Soto, will be speaking tonight at @FIU_MBUS for their ‘Art Talks’ series #MBArtsAndCulture #MBRisingAbovepic.twitter.com/VxwxznSnTb",MiamiBeachNews,17931773,,#MBArtsAndCulture #MBRisingAbovepic,Tue Apr 09 14:47:54 +0000 2019
682,. @MiamiBeachPride filled Ocean Drive with #LGBTQ love! https://www.miaminewtimes.com/arts/miami-beach-pride-parade-2019-the-best-floats-performers-and-fashion-11140282 … #MiamiBeachPride,MiamiBeachNews,17931773,,#LGBTQ #MiamiBeachPride,Tue Apr 09 14:02:46 +0000 2019
683,Thank you for showing off your PRIDE this weekend #MiamiBeachPride https://twitter.com/jdonith/status/1115355091253510145 …,MiamiBeachNews,17931773,,#MiamiBeachPride,Tue Apr 09 00:23:41 +0000 2019
684,No major motion picture filming will be taking place Sunday 4/14 due to scheduling conflicts. Read more here: https://conta.cc/2UnhgEA pic.twitter.com/GeeoMhAI2Q,MiamiBeachNews,17931773,,,Mon Apr 08 20:51:36 +0000 2019
685,Discuss the topics on the April 10 commission meeting agenda with @MichaelGongora tonight at the Power Walk & Talk! Walk will begin at Bandshell Park at 6 PMpic.twitter.com/F1YCVFhWOi,MiamiBeachNews,17931773,,,Mon Apr 08 14:07:14 +0000 2019
686,"Have old batteries, light bulbs or propane tanks you need to get rid of? Drop off these and other household hazardous waste items until 3 PM today at 40 ST & Chase Avenue #MBRisingAbovepic.twitter.com/XrnuMmvDeW",MiamiBeachNews,17931773,,#MBRisingAbovepic,Sun Apr 07 14:07:16 +0000 2019
687,"In case you missed it, tomorrow you can drop off your Household Hazardous Waste from 8 AM to 3 PM at 40 Street & Chase Avenue. Check out the full list of acceptable materials below #MBRisingAbovepic.twitter.com/H2aHbuIJbA",MiamiBeachNews,17931773,,#MBRisingAbovepic,Sat Apr 06 18:26:02 +0000 2019
688,Come out to celebrate @MiamiBeachPride today from 2 PM to 5 PM with a special edition of #Fun4Kids on @LncolnRd at Euclid Oval with Drag Queen Story Hour & face painting! #onLincoln #MiamiBeachPride pic.twitter.com/r7H6iQUqGx,MiamiBeachNews,17931773,,#Fun4Kids #onLincoln #MiamiBeachPride,Sat Apr 06 14:33:01 +0000 2019
689,Our monthly Friday Night Live is underway Stop by the Normandy Fountain now until 10 PM to enjoy live music and food from our local restaurants #KnowNobepic.twitter.com/kA8dtolCx3,MiamiBeachNews,17931773,,#KnowNobepic,Sat Apr 06 00:09:36 +0000 2019
690,Celebrating #MiamiBeachPride at our Pride Family Night at Flamingo Park Pool #MBParkspic.twitter.com/Fu1OjsqdMs,MiamiBeachNews,17931773,,#MiamiBeachPride #MBParkspic,Fri Apr 05 22:24:40 +0000 2019
691,Don’t forget to check out our #MBParks Recreation Review magazine & get summer camp ready: https://issuu.com/cityofmiamibeach/docs/2019_summer_camp_rr_?e=30429945/68907289 … pic.twitter.com/xY4ez8XOdx,MiamiBeachNews,17931773,,#MBParks,Fri Apr 05 19:51:07 +0000 2019
692,"Hear what will be discussed in the April 10 commission meeting during Monday night's power walk & talk with Commissioner @MichaelGongora! Monday, April 8 | 6 PM Starting point: Bandshell Parkpic.twitter.com/xCYlKOy9xm",MiamiBeachNews,17931773,,,Fri Apr 05 18:40:01 +0000 2019
693,Mark your calendars for the upcoming #UnitedInConversation to discuss climate change & sea level rise at @panthercoffee in Sunset Harbour. This event is hosted in partnership with @UnitedWayMiami #MBRisingAbovepic.twitter.com/MRoTIWvZE0,MiamiBeachNews,17931773,,#UnitedInConversation #MBRisingAbovepic,Fri Apr 05 17:19:01 +0000 2019
