Tweet,User,User_ID,Geo,HashTag,Date
295,We are expecting heavy rain throughout the weekend. Please avoid driving through or coming in contact with flood waters #MBRisingAbovepic.twitter.com/hhnHV2hBkr,MiamiBeachNews,17931773,,#MBRisingAbovepic,Sat Jun 08 18:45:03 +0000 2019
296,"We’re in a summer state of mind! #MBParks hosted their summer camp meet & greet today, we can’t wait for the first day of camp pic.twitter.com/i56JatOcKB",MiamiBeachNews,17931773,,#MBParks,Sat Jun 08 18:16:53 +0000 2019
297,We celebrate #WorldOceansDay by working hard to keep our waterways clean & our beaches healthy! How are you celebrating? #MBRisingAbovepic.twitter.com/gPQ0p1HCCa,MiamiBeachNews,17931773,,#WorldOceansDay #MBRisingAbovepic,Sat Jun 08 14:56:12 +0000 2019
298,Tonight’s event has been cancelled due to the weather.https://twitter.com/MiamiBeachNews/status/1137008718170742785 …,MiamiBeachNews,17931773,,,Fri Jun 07 22:03:07 +0000 2019
299,"The latest in #MiamiBeach news, events & more can be found in our bi-weekly newsletter: https://conta.cc/2I1ghC0 pic.twitter.com/L0GG6JoPrP",MiamiBeachNews,17931773,,#MiamiBeach,Fri Jun 07 18:11:05 +0000 2019
300,The weekend is almost here & the best place to kick it off is at the Normandy Fountain with live music! See you at 6 PM: https://www.facebook.com/events/359855361302484/ … #KnowNoBe pic.twitter.com/5UbwtJbgJr,MiamiBeachNews,17931773,,#KnowNoBe,Fri Jun 07 14:49:37 +0000 2019
301,Register now to help #KeepMBClean: http://www.1hotels.com/south-beach/discover/events … https://twitter.com/OfficialJoelF/status/1136996230830153730 …,MiamiBeachNews,17931773,,#KeepMBClean,Fri Jun 07 14:06:29 +0000 2019
302,"If you need help inspecting the doughnuts, we're willing to step in #NationalDoughnutDay https://twitter.com/ERodriguez782/status/1136983716365029376 …",MiamiBeachNews,17931773,,#NationalDoughnutDay,Fri Jun 07 13:20:18 +0000 2019
303,Plan your commute to/from #MiamiBeach with @MyFDOT_Miami’s interactive map with info on scheduled construction lane closures: http://www.i395-miami.com/miamibeachtrafficreport/ …pic.twitter.com/PeBNWuBS2t,MiamiBeachNews,17931773,,#MiamiBeach,Thu Jun 06 21:05:45 +0000 2019
304,Flamingo Park has changed quite a bit #MBParkshttps://twitter.com/FIU_Digital_Lib/status/1136674674081820672 …,MiamiBeachNews,17931773,,#MBParkshttps,Thu Jun 06 18:12:37 +0000 2019
305,"#WorldOceansDay celebrates the importance of a natural resource that provides beauty, recreational opportunities & even oxygen! Join us for a clean-up with @1Hotels & other local partners through the streets of South Beach on Saturday: http://www.1hotels.com/south-beach/discover/events … #PlasticFreeMBpic.twitter.com/N33Vr0xSHl",MiamiBeachNews,17931773,,#WorldOceansDay #PlasticFreeMBpic,Thu Jun 06 16:44:49 +0000 2019
306,"Shout out to @SouthPointeElem for keeping over 7,000 plastic utensils out of the environment by using reusable utensils for a month! Congrats to Ms. Bresset's 3rd grade class for winning the #PlasticFreeMB competition, they got to enjoy a @TheFrieze ice cream partypic.twitter.com/QHOMo0b970",MiamiBeachNews,17931773,,#PlasticFreeMB,Thu Jun 06 14:34:27 +0000 2019
307,The Engagement Toolbox is the best way to view all the ways to connect with the City: https://www.miamibeachfl.gov/city-hall/communications/stay-informed/ … pic.twitter.com/9Nvw2uBRE0,MiamiBeachNews,17931773,,,Thu Jun 06 13:58:38 +0000 2019
308,"It’s Code Enforcement Appreciation week! Commission presented a proclamation to our Code Enforcement Department, a big thank you to them for all that they do pic.twitter.com/2Kl3Uog9Us",MiamiBeachNews,17931773,,,Wed Jun 05 22:47:03 +0000 2019
309,Your weekly guide to all things #MBArtsAndCulture is here: https://myemail.constantcontact.com/Your-MB-Arts---Culture-Fix-.html?soid=1011085968389&aid=CegP8lYT-6M … pic.twitter.com/mxIG39fAmt,MiamiBeachNews,17931773,,#MBArtsAndCulture,Wed Jun 05 19:02:44 +0000 2019
310,"#Construction Advisory: @MyFDOT_Miami will continuously close the Alton Rd flyover on the MacArthur Cswy beginning Sunday night June 16 through Monday, July 1. View advisory here: https://conta.cc/2QPL6MF pic.twitter.com/wGn9ctbyly",MiamiBeachNews,17931773,,#Construction,Wed Jun 05 17:52:42 +0000 2019
311,Change up your Friday plans & join us at the Normandy Fountain for Friday Night Live! #KnowNoBe https://www.facebook.com/events/359855361302484/?ti=icl …pic.twitter.com/4Jjyi3xL2F,MiamiBeachNews,17931773,,#KnowNoBe,Wed Jun 05 17:21:28 +0000 2019
312,"Celebrate the future site of the pocket park at 2001 N Bay Road next Tuesday, June 11! #MBParkspic.twitter.com/aPphS0BWbI",MiamiBeachNews,17931773,,#MBParkspic,Wed Jun 05 16:49:17 +0000 2019
313,#Construction Advisory: View an interactive map of @MyFDOT_Miami construction projects that impact traffic to/from Miami Beach: http://www.i395-miami.com/miamibeachtrafficreport/ …pic.twitter.com/9xGz1PdTJR,MiamiBeachNews,17931773,,#Construction,Wed Jun 05 16:07:52 +0000 2019
314,Are you watching today’s Commission meeting? Tune in now or stream online here: https://www.miamibeachfl.gov/government/mbtv/ …pic.twitter.com/70SP033Adn,MiamiBeachNews,17931773,,,Wed Jun 05 14:04:23 +0000 2019
315,LOL genius,MiamiBeachNews,17931773,,,Wed Jun 05 12:15:08 +0000 2019
316,Our pants are already fitting us tight #ExperienceMiamiBeach https://twitter.com/MiamiandBeaches/status/1135958178863230976 …,MiamiBeachNews,17931773,,#ExperienceMiamiBeach,Tue Jun 04 20:28:34 +0000 2019
317,#Construction Advisory: @MyFDOT_Miami will have a partial lane closure of the EB MacArthur Cswy right turn lane onto SB Alton Rd taking place this week from 9 AM to 3:30 PM. View additional info below pic.twitter.com/4sVQVMiFUb,MiamiBeachNews,17931773,,#Construction,Tue Jun 04 20:09:45 +0000 2019
318,"Get summer ready with us by hitting the beach for a bootcamp & yoga workout on Saturday, June 8. Secure your free spot NOW: https://bit.ly/30lCT7B #KnowNoBepic.twitter.com/3euwXuJXjj",MiamiBeachNews,17931773,,#KnowNoBepic,Tue Jun 04 17:13:25 +0000 2019
319,View which Miami Beach hotspots made @OceanDriveMag’s list of the 8 places to be this summer: https://oceandrive.com/the-8-best-places-to-be-this-summer-in-miami … #ExperienceMiamiBeach,MiamiBeachNews,17931773,,#ExperienceMiamiBeach,Tue Jun 04 15:18:50 +0000 2019
320,You know where you can find us on the first Friday of each month! We’ll see you at the Normandy Fountain to kick off the weekend: https://www.facebook.com/events/359855361302484/?ti=icl … #KnowNoBe pic.twitter.com/6s9gyx0VdO,MiamiBeachNews,17931773,,#KnowNoBe,Tue Jun 04 14:40:50 +0000 2019
321,Always going above & beyond #MBeKindhttps://twitter.com/MiamiBeachFire/status/1135903148848156672 …,MiamiBeachNews,17931773,,#MBeKindhttps,Tue Jun 04 13:45:05 +0000 2019
322,As we enter #HurricaneSeason it’s important to not only prepare at home but in your business! Learn more: https://myemail.constantcontact.com/Hurricane-season-is-here--Are-you-ready-.html?soid=1011085968389&aid=NumKUuaZaa8 …pic.twitter.com/4mI2WeQgAC,MiamiBeachNews,17931773,,#HurricaneSeason,Tue Jun 04 13:18:22 +0000 2019
323,Protect yourself from mosquito bites & the diseases they may carry #FightTheBite http://www.miamidade.gov/mosquito pic.twitter.com/WSS9uAar7S,MiamiBeachNews,17931773,,#FightTheBite,Mon Jun 03 20:20:02 +0000 2019
324,Did you get your tango on with us last month? Look out for more events coming to North Beach! #KnowNoBe #MBArtsAndCulturepic.twitter.com/35mQy7U9Pz,MiamiBeachNews,17931773,,#KnowNoBe #MBArtsAndCulturepic,Mon Jun 03 19:24:19 +0000 2019
325,The best eats & drinks this week include Fi'lia South Beach & the Traymore by Michael Schwartz! https://www.miaminewtimes.com/restaurants/things-to-do-miami-food-and-drink-events-june-3-through-june-6-11184944 … #ExperienceMiamiBeach,MiamiBeachNews,17931773,,#ExperienceMiamiBeach,Mon Jun 03 17:35:54 +0000 2019
326,We're still not over the amazing #HyundairAirAndSeaShow! Thanks to everyone who joined us in watching in awe @USASalutepic.twitter.com/nCO6eAOJNW,MiamiBeachNews,17931773,,#HyundairAirAndSeaShow,Mon Jun 03 16:54:26 +0000 2019
327,Congrats to all of the 2019 grads! https://twitter.com/MBSHPTSA/status/1135582176140021760 …,MiamiBeachNews,17931773,,,Mon Jun 03 16:42:44 +0000 2019
328,"Walk the walk with us & @MayorDanGelber on Wednesday, June 12 to #KeepMBClean! We begin at 5:30 PM at City Hall pic.twitter.com/FqtB2LvWQZ",MiamiBeachNews,17931773,,#KeepMBClean,Mon Jun 03 16:25:03 +0000 2019
329,"‘Miami Beach Taking Climate Change, Rising Sea Levels Very Seriously’ & more on @CBSMiami: https://miami.cbslocal.com/2019/05/28/miami-beach-climate-change-rising-sea-levels/ … #MBRisingAbove",MiamiBeachNews,17931773,,#MBRisingAbove,Sat Jun 01 12:31:29 +0000 2019
330,Need a dinner recommendation? #ExperienceMiamiBeach https://twitter.com/Miamicom/status/1134563246621569024 …,MiamiBeachNews,17931773,,#ExperienceMiamiBeach,Fri May 31 20:55:52 +0000 2019
331,#CONSTRUCTION Advisory: View an interactive map with information on scheduled lane closures for @MyFDOT_Miami Construction Projects that affect traffic to/from and in Miami Beach: http://www.i395-miami.com/miamibeachtrafficreport/ …pic.twitter.com/MufNIzeQ7h,MiamiBeachNews,17931773,,#CONSTRUCTION,Fri May 31 19:22:09 +0000 2019
332,Take the guess work out of what you'll do for Dad this #FathersDay & spend the afternoon kayaking! #MBParkspic.twitter.com/oApH07s8Em,MiamiBeachNews,17931773,,#FathersDay #MBParkspic,Fri May 31 18:32:20 +0000 2019
333,"#HurricaneSeason officially begins tomorrow, June 1! Are you ready? https://conta.cc/2MjSvoZ pic.twitter.com/hmMNd9y6hH",MiamiBeachNews,17931773,,#HurricaneSeason,Fri May 31 17:13:48 +0000 2019
334,We made Allison Park a little greener today! Thanks to our resident volunteers & @girlscouts troop 1802 for helping us kick off the planting of 35 trees this morning #MBRisingAbovepic.twitter.com/EJotHzgnJJ,MiamiBeachNews,17931773,,#MBRisingAbovepic,Fri May 31 14:26:28 +0000 2019
335,Our FREE On-Demand Transit Service pilot program begins today at 2 p.m. Today's Freebee ribbon cutting has been postponed. Visit http://www.mbfreebee.com for more information on this new service!pic.twitter.com/O8MmNQSDJ1,MiamiBeachNews,17931773,,,Fri May 31 14:03:39 +0000 2019
336,"""Miami Beach's pilot program w/ @RideFreebee will serve the Mid Beach area, to provide door-to-door transportation to areas underserved by the city’s trolley & county transit service. The pilot program will run through September 30"" Read more @Bisnow:https://www.bisnow.com/south-florida/news/economy/freebee-miami-electric-cars-99168 …",MiamiBeachNews,17931773,,,Thu May 30 19:31:05 +0000 2019
337,Come out to @WeWork on @LncolnRd (350 Lincoln Rd) for another workshop in our capacity building series! Storytelling & Branding: How to build a brand that matters Reserve your spot by emailing: ed@miamibeachfl.govpic.twitter.com/7ERJFcaeHF,MiamiBeachNews,17931773,,,Thu May 30 16:47:24 +0000 2019
338,"With our @Resilient305 partners, the @100ResCities President praised our newly launched strategy for having real money behind it & the fact it’s not just about climate adaptation, it’s about improving lives & being a more #Resilient305! #MBRisingAbovepic.twitter.com/lD1c8m7v0B",MiamiBeachNews,17931773,,#Resilient305 #MBRisingAbovepic,Thu May 30 15:43:14 +0000 2019
339,#MBRisingAbovehttps://twitter.com/Peter_C_Jenkins/status/1134097083349315585 …,MiamiBeachNews,17931773,,#MBRisingAbovehttps,Thu May 30 14:12:28 +0000 2019
340,"“I don’t think the sky is falling, I think we need to get to work” - @MayorDanGelber Today we stood side by side with @MiamiDadeCounty & @CityofMiami to celebrate the launch of the @Resilient305 strategy! #MBRisingAbove #Resilient305pic.twitter.com/Xzxi2hAE2m",MiamiBeachNews,17931773,,#MBRisingAbove #Resilient305pic,Thu May 30 14:10:43 +0000 2019
341,Miami Beach is proud to be a part of this strategy! Together we will be a more #Resilient305 #MBRisingAbovehttps://twitter.com/MiamiDadeCounty/status/1134090620958650368 …,MiamiBeachNews,17931773,,#Resilient305 #MBRisingAbovehttps,Thu May 30 13:37:50 +0000 2019
342,Last night over 100 people joined us to discuss climate change as we launched a special edition of MB Magazine that has begun to hit homes! Weren't able to watch live? Rewatch the conversation with questions you submitted here: https://www.youtube.com/watch?v=ZneU7u9BbQ0 … #MBRisingAbovepic.twitter.com/xkIG1A1tJr,MiamiBeachNews,17931773,,#MBRisingAbovepic,Thu May 30 00:25:41 +0000 2019
343,Take the #MBTrolley South Beach Loop A & B for Culture Crawl tonight! We begin at 6 PM #MBArtsAndCulturepic.twitter.com/KtxEKpvK1k,MiamiBeachNews,17931773,,#MBTrolley #MBArtsAndCulturepic,Wed May 29 20:46:34 +0000 2019
344,Your weekly dose of Arts & Culture news/events in Miami Beach: https://conta.cc/2I6mf3p #MBArtsAndCulture pic.twitter.com/QF4c9dwsQV,MiamiBeachNews,17931773,,#MBArtsAndCulture,Wed May 29 19:29:37 +0000 2019
345,"Love our movies on the lawn at SoundScape Park? As part of our G.O. Bond, the @nwsymphony is getting 4K technology at the New World Center! Read more via @MiamiTodayNews: https://www.miamitodaynews.com/2019/05/28/new-world-symphony-funded-for-4k-wallcast-technology/ … #GOMB2018",MiamiBeachNews,17931773,,#GOMB2018,Wed May 29 18:30:03 +0000 2019
346,"We're bringing you another edition of our Culture Crawl! TONIGHT, explore Miami Beach like never before: http://www.mbartsandculture.org/event/miami-beach-culture-crawl/ … #MBArtsAndCulturepic.twitter.com/JDQs3iG3fq",MiamiBeachNews,17931773,,#MBArtsAndCulturepic,Wed May 29 16:45:12 +0000 2019
347,Have you spotted Miami Beach in your favorite movie? 'This map marks the spots where movies & TV shows were filmed in South Florida' via @johnnydiazmiami & @SunSentinel: https://www.sun-sentinel.com/features/fl-fea-miami-movie-tv-productions-map-20190528-ygdfnr5dw5dyrdbrkte4o27fja-story.html … #ExperienceMiamiBeach,MiamiBeachNews,17931773,,#ExperienceMiamiBeach,Wed May 29 15:30:16 +0000 2019
348,Thank you to everyone who joined us in honoring the brave men & women who gave their lives to serve our country #MemorialDay @MiamiBeachPD @MiamiBeachFirepic.twitter.com/KGptATiW5g,MiamiBeachNews,17931773,,#MemorialDay,Wed May 29 15:08:57 +0000 2019
349,Freebee is Partnering with the City of Miami Beach — Bringing On-Demand Transit Service to Mid-Beach Residents http://www.MBFreebee.com pic.twitter.com/oFZUp0fCiX,MiamiBeachNews,17931773,,,Wed May 29 14:01:09 +0000 2019
350,You can’t be a resilient city if you don’t have resilient people! Thank you to everyone who joined us for tonight’s conversation #MBRisingAbovepic.twitter.com/cMu5dT2x9e,MiamiBeachNews,17931773,,#MBRisingAbovepic,Tue May 28 23:35:15 +0000 2019
351,". @CityManagerMB “Why me? Why now?” 1. Neighborhood projects aren’t just stormwater, they fix aging infrastructure. 2. You don’t want to wait until it’s too late. SLR is incremental, as years go by, properties will see more water 3. Projects protect city assets #MBRisingAbovepic.twitter.com/aIJary0Qa1",MiamiBeachNews,17931773,,#MBRisingAbovepic,Tue May 28 23:05:37 +0000 2019
352,Assistant City Manager Eric Carpenter shares that building the city for the future is about designing a city we want to live in while reducing the risk and disruption of flooding. #MBRisingAbove Watch live: http://www.facebook.com/cityofmiamibeach …pic.twitter.com/biO5vQ73fu,MiamiBeachNews,17931773,,#MBRisingAbove,Tue May 28 22:54:51 +0000 2019
353,"“We’re not building for the past, but for the future” - Chief Resiliency Officer Susy Torriente #MBRisingAbove Watch live: http://www.facebook.com/cityofmiamibeach …pic.twitter.com/3TxaT494yi",MiamiBeachNews,17931773,,#MBRisingAbove,Tue May 28 22:49:36 +0000 2019
354,Watch live on our Facebook page tonight’s Climate Change Conversation at the @ColonyTheatreMB: http://www.facebook.com/cityofmiamibeach … #MBRisingAbovepic.twitter.com/wrzLhvJa7q,MiamiBeachNews,17931773,,#MBRisingAbovepic,Tue May 28 22:38:31 +0000 2019
355,Join us at 6:30 PM at the @ColonyTheatreMB for our Climate Change Conversation! #MBRisingAbovepic.twitter.com/krlQTqyqmY,MiamiBeachNews,17931773,,#MBRisingAbovepic,Tue May 28 19:58:13 +0000 2019
356,'Take a sun-soaked break at @TheSetai in Miami Beach' via @DailyMailUK: https://www.dailymail.co.uk/home/you/article-7066499/Take-sun-soaked-break-Setai-hotel-Miamis-South-Beach.html … #ExperienceMiamiBeach pic.twitter.com/CKVVhW7RoY,MiamiBeachNews,17931773,,#ExperienceMiamiBeach,Tue May 28 18:27:50 +0000 2019
357,Glad you appreciate our #PlasticFreeMB city!https://twitter.com/CazzaPomMom1517/status/1133416068674924545 …,MiamiBeachNews,17931773,,#PlasticFreeMB,Tue May 28 17:55:05 +0000 2019
358,"This Thursday, join us at @WeWork located on @LncolnRd, for another workshop in our capacity building series. Storytelling & Branding: How to build a brand that matters RSVP today: ed@miamibeachfl.govpic.twitter.com/OKq7ZbuydT",MiamiBeachNews,17931773,,,Tue May 28 17:12:03 +0000 2019
359,There's a new Sunday Brunch at the @WHotels! You know where to find us this weekend #ExperienceMiamiBeach https://www.miaminewtimes.com/restaurants/josh-gripper-w-south-beach-sunday-brunch-11180266 …pic.twitter.com/LGxnHTZ9TD,MiamiBeachNews,17931773,,#ExperienceMiamiBeach,Tue May 28 16:07:03 +0000 2019
360,"Looking for an inexpensive date night idea? Come out to our monthly Culture Crawl tomorrow, May 29 & enjoy exciting exhibits, live music, free transportation around the city & more for FREE! #MBArtsAndCulture http://www.mbartsandculture.org/event/miami-beach-culture-crawl/ …pic.twitter.com/gaAjwn94ew",MiamiBeachNews,17931773,,#MBArtsAndCulture,Tue May 28 15:18:23 +0000 2019
361,"Tonight we're hosting a panel discussion on climate change at @ColonyTheatreMB! Attendees will have an opportunity to partake in the dialogue moderated by @MayorDanGelber. There's still time to submit questions to our panel, email/RSVP: feedback@miamibeachfl.gov #MBRisingAbovepic.twitter.com/8dMDZFrJVn",MiamiBeachNews,17931773,,#MBRisingAbovepic,Tue May 28 14:48:02 +0000 2019
362,Every year our city becomes a destination for nesting sea turtles & their babies beginning April through October. It’s essential to remember the importance of protecting the environment & species that make our city unique! #MBShareTheShore http://www.mbrisingabove.com/seaturtles pic.twitter.com/gvhT4U0cbU,MiamiBeachNews,17931773,,#MBShareTheShore,Tue May 28 14:15:05 +0000 2019
363,We're hosting a panel discussion on climate change to kick off a special edition of MB Magazine tomorrow! Have questions you want the panel to answer? Email/RSVP today: feedback@miamibeachfl.gov #MBRisingAbovepic.twitter.com/63ci5K0S1u,MiamiBeachNews,17931773,,#MBRisingAbovepic,Mon May 27 22:42:40 +0000 2019
364,"Thank you to the brave men & women who paid the ultimate sacrifice to protect our freedom. Today & every day, we honor your memory #MemorialDay pic.twitter.com/zfK7fWFg3V",MiamiBeachNews,17931773,,#MemorialDay,Mon May 27 14:18:17 +0000 2019
365,. @official_flo takes the stage at the @USASalute #HyundaiAirAndSeaShow Beach Concert! #ExperienceMiamiBeachpic.twitter.com/GwCX5THRHR,MiamiBeachNews,17931773,,#HyundaiAirAndSeaShow #ExperienceMiamiBeachpic,Mon May 27 00:58:39 +0000 2019
366,The Young Musicians Unite take the stage for the @USASalute Beach Concert! You probably recognize them from our #MBYouthFest #HyundaiAirAndSeaShowpic.twitter.com/1sCfwwXPZj,MiamiBeachNews,17931773,,#MBYouthFest #HyundaiAirAndSeaShowpic,Sun May 26 22:17:41 +0000 2019
367,#TRAFFIC: Accident at the WB Venetian Cswy toll plaza causing delays.,MiamiBeachNews,17931773,,#TRAFFIC,Sun May 26 22:07:09 +0000 2019
368,All smiles for day of the #HyundaiAirAndSeaShow!pic.twitter.com/rxsGEAmKSz,MiamiBeachNews,17931773,,#HyundaiAirAndSeaShow,Sun May 26 19:16:26 +0000 2019
369,Another beautiful day in paradise #ExperienceMiamiBeach https://twitter.com/CitiBikeMiami/status/1132662266443247618 …,MiamiBeachNews,17931773,,#ExperienceMiamiBeach,Sun May 26 15:08:23 +0000 2019
370,Do you offer flying lessons @BlueAngels? We’re up for the challenge! @USASalute #HyundaiAirAndSeaShow pic.twitter.com/LBErEG1BBl,MiamiBeachNews,17931773,,#HyundaiAirAndSeaShow,Sat May 25 20:03:16 +0000 2019
371,Best view of the show is right here on Miami Beach #HyundaiAirAndSeaShowhttps://twitter.com/CBoomerVazquez/status/1132359378898759680 …,MiamiBeachNews,17931773,,#HyundaiAirAndSeaShowhttps,Sat May 25 18:57:09 +0000 2019
372,"Wow, we’d be afraid to ride on a plane with that pilot @USASalute #HyundaiAirAndSeaShowpic.twitter.com/9CeyXCglvI",MiamiBeachNews,17931773,,#HyundaiAirAndSeaShowpic,Sat May 25 18:50:10 +0000 2019
373,Come out to Ocean Drive for an amazing array of activations for our 3rd Annual #HyundaiAirAndSeaShow!https://twitter.com/USASalute/status/1132338073797386241 …,MiamiBeachNews,17931773,,#HyundaiAirAndSeaShow,Sat May 25 17:58:59 +0000 2019
374,Swing by the @FIU_MBUS (1618 Washington Ave) today through Monday from 10 AM - 5 PM for the ‘Out of Context’ pop-up! #MBArtsAndCulture http://www.mbartsandculture.org/event/reframe-memorial-day-weekend/ …pic.twitter.com/KE30EKEA4j,MiamiBeachNews,17931773,,#MBArtsAndCulture,Sat May 25 15:15:40 +0000 2019
375,"Throughout Memorial Day Weekend, ignite the imagination while challenging perspectives with our ReFrame Miami Beach cultural events: http://www.mbartsandculture.org/event/reframe-memorial-day-weekend/ … #MBArtsAndCulture #MDW2019 pic.twitter.com/nwQ2TaqvHb",MiamiBeachNews,17931773,,#MBArtsAndCulture #MDW2019,Sat May 25 13:56:01 +0000 2019
376,"Rise & shine Miami Beach! Join us for the #HyundaiAirAndSeaShow beginning at 10 AM, beach viewing is from 11 ST to 14 ST More info: http://www.memorialdaymb.com https://twitter.com/CBSMiami/status/1131986371764211712 …",MiamiBeachNews,17931773,,#HyundaiAirAndSeaShow,Sat May 25 13:33:16 +0000 2019
377,Ready for the weekend #ExperienceMiamiBeachpic.twitter.com/pEnqffhh8j,MiamiBeachNews,17931773,,#ExperienceMiamiBeachpic,Sat May 25 00:17:33 +0000 2019
378,Yes! Saturday and Sunday,MiamiBeachNews,17931773,,,Fri May 24 21:50:24 +0000 2019
379,"Thank you @jamieNBC6 for joining us for the ReFrame Miami Beach media preview. We have a lot of great events lined up, visit http://www.memorialdaymb.com to coordinate your weekend plans! #MDW2019pic.twitter.com/bG9j0n07vB – at The Standard Spa, Miami Beach",MiamiBeachNews,17931773,,#MDW2019pic,Fri May 24 21:50:01 +0000 2019
380,You can visit http://www.memorialdaymb.com to view info on our cultural activations this year!,MiamiBeachNews,17931773,,,Fri May 24 20:11:52 +0000 2019
381,Join the City of Miami Beach for a Memorial Day Commemoration – With a Wreath-Laying Ceremony and 21 Gun Salute #MDW2019pic.twitter.com/OMI75WhVrv,MiamiBeachNews,17931773,,#MDW2019pic,Fri May 24 20:10:41 +0000 2019
382,Catch the full #HyundaiAirAndSeaShow tomorrow and Saturday! #MDW2019 http://www.memorialdaymb.com https://twitter.com/volvoshine/status/1131982398193844225 …,MiamiBeachNews,17931773,,#HyundaiAirAndSeaShow #MDW2019,Fri May 24 19:43:02 +0000 2019
383,"Unfortunately Comcast damaged a fiber line during their routine maintenance earlier today, they are currently on site fixing this issue.",MiamiBeachNews,17931773,,,Fri May 24 18:47:22 +0000 2019
384,The Comcast team is on-site repairing the fiber line which was damaged during their routine maintenance. We will update once repairs have been made.https://twitter.com/MiamiBeachNews/status/1131989357022388224 …,MiamiBeachNews,17931773,,,Fri May 24 18:46:33 +0000 2019
385,"Read the latest bi-weekly newsletter with city information, events & more: https://conta.cc/2HTOK4b pic.twitter.com/znTE5GIr8Q",MiamiBeachNews,17931773,,,Fri May 24 18:36:57 +0000 2019
386,#Advisory: The 7 Street garage (located at 7 ST & Collins Avenue) is currently unable to process credit cards and is only accepting cash. We apologize for the inconvenience.,MiamiBeachNews,17931773,,#Advisory,Fri May 24 18:24:28 +0000 2019
387,Use code MBResident for 10% off at the Beach Club! #HyundaiAirAndSeaShow https://twitter.com/ERodriguez782/status/1131975927246856194 …,MiamiBeachNews,17931773,,#HyundaiAirAndSeaShow,Fri May 24 17:36:02 +0000 2019
388,"Use our #MBTrolley to get around this Memorial Day Weekend! From parking/traffic information to events, here is everything you need to know about #MDW2019 on Miami Beach: https://conta.cc/2HJCIdB pic.twitter.com/Mr4RIS8h9J",MiamiBeachNews,17931773,,#MBTrolley #MDW2019,Fri May 24 15:53:05 +0000 2019
389,Can you take us up in the sky next @BlueAngels?! We can't wait for tomorrow's #HyundaiAirAndSeaShow http://www.memorialdaymb.com https://twitter.com/EricYutzyWPLG/status/1131869054430527490 …,MiamiBeachNews,17931773,,#HyundaiAirAndSeaShow,Fri May 24 14:36:56 +0000 2019
390,Last night we tangoed under the stars at the Normandy Fountain! Keep an eye out for more events in North Beach #KnowNoBepic.twitter.com/dghuv77xSu,MiamiBeachNews,17931773,,#KnowNoBepic,Fri May 24 13:51:46 +0000 2019
391,"Did you know, mosquitoes breed by laying eggs in & near standing water? We're headed into rainy season, make sure to #DrainAndCover! Learn more about how you can #FightTheBite: https://conta.cc/2HRb9iu pic.twitter.com/Qr34q2ezV9",MiamiBeachNews,17931773,,#DrainAndCover #FightTheBite,Thu May 23 19:11:56 +0000 2019
392,"#TRAFFIC: Crash on 18 ST between Washington/James, all EB/WB lanes are closed.",MiamiBeachNews,17931773,,#TRAFFIC,Thu May 23 18:21:23 +0000 2019
393,"Also, all sea turtles that were born on our beaches, come back to start their own families in our sand #MBShareTheShore https://twitter.com/HistoryMiami/status/1131597757758750721 …",MiamiBeachNews,17931773,,#MBShareTheShore,Thu May 23 16:39:40 +0000 2019
