Tweet,User,User_ID,Geo,HashTag,Date
449,‘The Perfect Gift:’ Company Giving Handgun To Each Employee As ‘Christmas Bonus’ http://dlvr.it/QrGf5f pic.twitter.com/mN7tM3u0sv,miaminewsnow,59516314,,,Thu Nov 15 00:39:04 +0000 2018
450,"Containment On Woolsey Fire Jumps, But Winds Still Unpredictable http://dlvr.it/QrG7q1 pic.twitter.com/u0px6KgQiA",miaminewsnow,59516314,,,Wed Nov 14 21:36:03 +0000 2018
451,BSO: Self-Confessed Parkland Shooter Nikolas Cruz Accused Of Attacking Jail Guard http://dlvr.it/QrFSqd pic.twitter.com/7CfyX18xlw,miaminewsnow,59516314,,,Wed Nov 14 18:29:04 +0000 2018
452,Teen Girl Dies After Being Hit By Car In Pembroke Pines http://dlvr.it/Qr8mKC pic.twitter.com/HkqUel6RgC,miaminewsnow,59516314,,,Tue Nov 13 18:03:35 +0000 2018
453,Marvel Creator Stan Lee Dies At 95 http://dlvr.it/Qr5HpD pic.twitter.com/Y6ItGlX9Gi,miaminewsnow,59516314,,,Mon Nov 12 23:06:07 +0000 2018
454,Tim Tebow To Host New CBS Series ‘Million Dollar Mile’ http://dlvr.it/Qr4mYs pic.twitter.com/2t492OcPIG,miaminewsnow,59516314,,,Mon Nov 12 20:03:05 +0000 2018
455,Veterans Honored In North Miami http://dlvr.it/Qr42pz pic.twitter.com/bJrWeHIhxr,miaminewsnow,59516314,,,Mon Nov 12 16:59:05 +0000 2018
456,World’s Largest Cruise Ship Makes Miami Debut http://dlvr.it/QqsZCq pic.twitter.com/OpGbWlJNv9,miaminewsnow,59516314,,,Fri Nov 09 18:36:04 +0000 2018
457,Heroes Among Us: Special South Florida Veterans http://dlvr.it/QqrlxX pic.twitter.com/hHK4CsEJ0J,miaminewsnow,59516314,,,Fri Nov 09 15:32:05 +0000 2018
458,CNN’s Jim Acosta Denied Entry To White House http://dlvr.it/QqpCy0 pic.twitter.com/BYHl1j1Q6A,miaminewsnow,59516314,,,Fri Nov 09 00:36:03 +0000 2018
459,Thousand Oaks Shooting: Marine Identified As Shooter In Borderline Bar Massacre http://dlvr.it/Qqn32W pic.twitter.com/uiRYSWF8Bo,miaminewsnow,59516314,,,Thu Nov 08 18:30:04 +0000 2018
460,"13 Killed, Including Deputy And Gunman, At Bar In Southern California http://dlvr.it/QqmF3D pic.twitter.com/9z5oiO2OEt",miaminewsnow,59516314,,,Thu Nov 08 15:28:04 +0000 2018
461,Jeff Sessions Resigns As Attorney General http://dlvr.it/Qqj553 pic.twitter.com/SScFsCVOMP,miaminewsnow,59516314,,,Wed Nov 07 21:35:32 +0000 2018
462,Florida’s Amendment 13 Ending Greyhound Dog Racing Passes http://dlvr.it/QqhPym pic.twitter.com/VA8OYVeoKS,miaminewsnow,59516314,,,Wed Nov 07 18:27:45 +0000 2018
463,Gillum Urges Supporters Not To Give Up After Loss http://dlvr.it/QqgbGc pic.twitter.com/34hLsUd5ry,miaminewsnow,59516314,,,Wed Nov 07 15:24:04 +0000 2018
464,Georgia Marching Band Spells Racial Slur During Halftime Performance http://dlvr.it/QqcLkG pic.twitter.com/OGOiOg4nF7,miaminewsnow,59516314,,,Tue Nov 06 20:58:03 +0000 2018
465,FedEx Raising Rates In January http://dlvr.it/QqW4fs pic.twitter.com/8TNAazSyEa,miaminewsnow,59516314,,,Mon Nov 05 17:32:04 +0000 2018
466,Former President Barack Obama Stops At Wynwood Restaurant Following Miami Rally http://dlvr.it/QqKm8h pic.twitter.com/wQly0V3Z2B,miaminewsnow,59516314,,,Sat Nov 03 01:15:49 +0000 2018
467,Fantasy Football Week 9: Fitzmagic Is Back! http://dlvr.it/QqKNGT pic.twitter.com/7xwbbSK8OL,miaminewsnow,59516314,,,Fri Nov 02 22:12:55 +0000 2018
468,Alec Baldwin Arrested After Fight Over Parking Spot http://dlvr.it/QqJrfG pic.twitter.com/CljhQgAYg1,miaminewsnow,59516314,,,Fri Nov 02 19:07:32 +0000 2018
469,ALDI Sandwich Recalled Due To Possible Salmonella Contamination http://dlvr.it/QqF05b pic.twitter.com/7PeD1rArUz,miaminewsnow,59516314,,,Thu Nov 01 21:39:41 +0000 2018
470,‘Birthright Citizenship Doesn’t Make Sense’: Florida GOP Gubernatorial Candidate Ron DeSantis To CBS4’s Jim DeFede http://dlvr.it/QqDTzx pic.twitter.com/TPXfqUgonH,miaminewsnow,59516314,,,Thu Nov 01 18:37:05 +0000 2018
471,"Uber Launches Monthly Subscription Service For Discounted Rates In Miami, 4 Other Cities http://dlvr.it/Qq7Rcv pic.twitter.com/OhX0JcqJJ6",miaminewsnow,59516314,,,Wed Oct 31 21:13:03 +0000 2018
472,Barbra Streisand To Appear On An All-New Carpool Karaoke With James Corden http://dlvr.it/Qq6cl4 pic.twitter.com/DOjlK2yncg,miaminewsnow,59516314,,,Wed Oct 31 18:09:06 +0000 2018
473,Man Wearing Trump T-Shirt Mistakenly Turned Away From Voting http://dlvr.it/Qq1Kfq pic.twitter.com/mkC9N6O2dS,miaminewsnow,59516314,,,Tue Oct 30 20:50:05 +0000 2018
474,Group Starts Petition To Move The Date Of Halloween http://dlvr.it/Qpvsj6 pic.twitter.com/KKCcNCksBv,miaminewsnow,59516314,,,Mon Oct 29 23:28:03 +0000 2018
475,Miami Police Horses Shocked By Exposed Wires http://dlvr.it/QpvCY7 pic.twitter.com/oZUJJhxc1f,miaminewsnow,59516314,,,Mon Oct 29 20:26:05 +0000 2018
476,Damon Wayans Set To Guest-Star On ‘Happy Together’ Tonight At 8:30 ET http://dlvr.it/QptMkF pic.twitter.com/Zq9UGH70Rt,miaminewsnow,59516314,,,Mon Oct 29 17:23:04 +0000 2018
477,"Nelson, Scott Race Will Come Down To The Wire http://dlvr.it/QpsMfl pic.twitter.com/K15AQUdXdO",miaminewsnow,59516314,,,Mon Oct 29 14:18:05 +0000 2018
478,Mail Bomb Suspect Set To Appear In Federal Court Monday http://dlvr.it/Qpqb29 pic.twitter.com/xIzzAmV4WY,miaminewsnow,59516314,,,Mon Oct 29 08:08:05 +0000 2018
479,Dozens Gather At Broward Vigil For Pittsburgh Shooting http://dlvr.it/Qppzrp pic.twitter.com/x52gBIYb7E,miaminewsnow,59516314,,,Mon Oct 29 05:04:04 +0000 2018
480,DA Files Criminal Homicide Charges Against Pittsburgh Synagogue Shooting Suspect http://dlvr.it/QpmqxM pic.twitter.com/oFhBePqshy,miaminewsnow,59516314,,,Sun Oct 28 16:48:33 +0000 2018
481,Facing South Florida: Discussing Political Impact Of Current Events With Patricia Mazzei & Marc Caputo http://dlvr.it/Qpm80x pic.twitter.com/B2vT9ajy9c,miaminewsnow,59516314,,,Sun Oct 28 13:46:03 +0000 2018
482,Pipe Bomb Suspect Cesar Sayoc Active On Social Media http://dlvr.it/Qpdl2n pic.twitter.com/0iJnnQv4Vv,miaminewsnow,59516314,,,Sat Oct 27 01:05:04 +0000 2018
483,Powerball Jackpot Jumps To $750 Million http://dlvr.it/QpVNSt pic.twitter.com/DNhGi9oFDU,miaminewsnow,59516314,,,Thu Oct 25 18:20:04 +0000 2018
484,Police: Student Urinated On Outlet In Attempt To Set School On Fire http://dlvr.it/QpTNbP pic.twitter.com/tJcrKuF6nQ,miaminewsnow,59516314,,,Thu Oct 25 15:14:06 +0000 2018
485,Suspicious Package Sent To Hotel Owned By Actor Robert DeNiro http://dlvr.it/QpSMdM pic.twitter.com/5XWOMamY1k,miaminewsnow,59516314,,,Thu Oct 25 12:08:05 +0000 2018
486,CDC: Don’t Dress Up Your Pet Chickens For Halloween http://dlvr.it/QpP00x pic.twitter.com/zpFCDlWHxz,miaminewsnow,59516314,,,Wed Oct 24 20:53:33 +0000 2018
487,Teacher’s Aide Fired After Allegedly Giving Special Needs Student A ‘Wedgie’ http://dlvr.it/QpN8cG pic.twitter.com/l8BfUNYOgh,miaminewsnow,59516314,,,Wed Oct 24 17:50:05 +0000 2018
488,Miami Police Search For Armed Suspect After Carjacking Attempt http://dlvr.it/QpM9L1 pic.twitter.com/k3pff1nboo,miaminewsnow,59516314,,,Wed Oct 24 14:47:06 +0000 2018
489,Dodgers-Red Sox World Series Odds http://dlvr.it/QpHTsk pic.twitter.com/Tko7S1ri1K,miaminewsnow,59516314,,,Tue Oct 23 23:27:58 +0000 2018
490,Shot Fired During Miami Beach Robbery http://dlvr.it/QpGq6j pic.twitter.com/Hm0IYkiN2b,miaminewsnow,59516314,,,Tue Oct 23 20:25:06 +0000 2018
491,Four Tourists From Miami & Guide Killed In Costa Rican Rafting Accident http://dlvr.it/Qp6v9r pic.twitter.com/341wHfcMEG,miaminewsnow,59516314,,,Mon Oct 22 13:51:33 +0000 2018
492,Saudi Arabia Confirms Missing Journalist Jamal Khashoggi Was Killed http://dlvr.it/Qnv7s2 pic.twitter.com/IdcyPnMfeN,miaminewsnow,59516314,,,Sat Oct 20 00:45:03 +0000 2018
493,Man Climbs Hialeah Cell Phone Tower http://dlvr.it/QntZXv pic.twitter.com/f379U6fYaT,miaminewsnow,59516314,,,Fri Oct 19 21:43:04 +0000 2018
494,WNBA Star Brittney Griner Airs Grievances With League Salaries On Instagram http://dlvr.it/QnsqcQ pic.twitter.com/6VF7LBpEb4,miaminewsnow,59516314,,,Fri Oct 19 18:39:45 +0000 2018
495,Mega Millions Is The Hot Ticket Friday http://dlvr.it/QnryC0 pic.twitter.com/efiqHDWLzq,miaminewsnow,59516314,,,Fri Oct 19 15:38:05 +0000 2018
496,Scare In The Air On Flight From Miami To Buenos Aires http://dlvr.it/Qnr0Ds pic.twitter.com/cBEJ3TZDYx,miaminewsnow,59516314,,,Fri Oct 19 12:33:03 +0000 2018
497,Pillsbury Introducing ‘Buddy The Elf’ Sugar Cookies For Holiday Season http://dlvr.it/QnmjzK pic.twitter.com/dixuiR9LPx,miaminewsnow,59516314,,,Thu Oct 18 21:20:04 +0000 2018
498,"House Ordered From Sears Catalog In 1920s Now ‘Haunted,’ Many Believe http://dlvr.it/QnlxRZ pic.twitter.com/5uiA8xnpVa",miaminewsnow,59516314,,,Thu Oct 18 18:16:59 +0000 2018
499,Florida Has First Case Of Child Contracting Rare Polio-Like Virus http://dlvr.it/Qnl1pY pic.twitter.com/YscjEx17lt,miaminewsnow,59516314,,,Thu Oct 18 15:14:07 +0000 2018
500,Monster Mega Millions Jackpot Swells To $900 Million http://dlvr.it/QngWKQ pic.twitter.com/FC5RLgpHmF,miaminewsnow,59516314,,,Wed Oct 17 23:57:04 +0000 2018
501,New Ticket Prices In Effect At Walt Disney World http://dlvr.it/QnfwsT pic.twitter.com/oOSPmEQyiF,miaminewsnow,59516314,,,Wed Oct 17 20:53:04 +0000 2018
502,‘The World’s Best’ To Premiere Immediately After Super Bowl LIII On CBS http://dlvr.it/Qnf7cG pic.twitter.com/FVbZATyTj5,miaminewsnow,59516314,,,Wed Oct 17 17:50:13 +0000 2018
503,Hungry And In A Hurry? These Are The Fastest Drive-Thrus In America http://dlvr.it/QndDr9 pic.twitter.com/Vt4WPYHVEC,miaminewsnow,59516314,,,Wed Oct 17 14:46:35 +0000 2018
504,"Verizon Gives Customer Credits In Bay, Gulf Counties http://dlvr.it/QnZJfn pic.twitter.com/4F8n3oiC7A",miaminewsnow,59516314,,,Wed Oct 17 02:31:36 +0000 2018
505,"Driver Hospitalized After Van Crashes, Flips In Miami http://dlvr.it/QnY5FZ pic.twitter.com/ISLmANYzyf",miaminewsnow,59516314,,,Tue Oct 16 20:26:33 +0000 2018
506,Mega Millions Jackpot Jumps To Record $667 Million http://dlvr.it/QnXFHG pic.twitter.com/3clrQxmvap,miaminewsnow,59516314,,,Tue Oct 16 17:24:34 +0000 2018
507,Mega Millions and Powerball Jackpots Are Close To A Billion Dollars http://dlvr.it/QnVKfK pic.twitter.com/D8aq6swXDo,miaminewsnow,59516314,,,Tue Oct 16 11:18:04 +0000 2018
508,‘Not One Alarm Went Off’: Friend Of Mother Who Lost Two Children In Fire http://dlvr.it/QnRg2K pic.twitter.com/4uW8NgeeMl,miaminewsnow,59516314,,,Mon Oct 15 23:06:33 +0000 2018
509,"Mega Millions, Powerball Jackpots Combined Climb To Nearly 1 Billion http://dlvr.it/QnQzR3 pic.twitter.com/vVnaRja7b7",miaminewsnow,59516314,,,Mon Oct 15 20:01:04 +0000 2018
510,Elizabeth Warren Releases DNA Test On Native American Heritage http://dlvr.it/QnQ862 pic.twitter.com/fEDZgP3eX5,miaminewsnow,59516314,,,Mon Oct 15 16:56:04 +0000 2018
511,Facing South Florida: The Gun Debate http://dlvr.it/QnKvqp pic.twitter.com/B9TFE7ZrlE,miaminewsnow,59516314,,,Sun Oct 14 22:37:03 +0000 2018
512,Facing South Florida: Battle for Congressional District 26 http://dlvr.it/QnKPvm pic.twitter.com/FzfXWjr1YV,miaminewsnow,59516314,,,Sun Oct 14 19:33:33 +0000 2018
513,Early-Morning Shooting Investigated In Lauderdale Lakes http://dlvr.it/QnJpFv pic.twitter.com/ElcXQWq8BQ,miaminewsnow,59516314,,,Sun Oct 14 16:29:53 +0000 2018
514,Facing South Florida: State Senator Rene Garcia On The Gun Debate http://dlvr.it/QnJ8Kz pic.twitter.com/E0fKXtk2w6,miaminewsnow,59516314,,,Sun Oct 14 13:24:03 +0000 2018
515,"Business Booming For Veronica Beard, ‘We Understand The Customer Because We Are The Customer’ http://dlvr.it/Qn9nwt pic.twitter.com/JOHjgsFW9i",miaminewsnow,59516314,,,Sat Oct 13 00:50:04 +0000 2018
516,Florida Father Loses Fight For Paternity Rights http://dlvr.it/Qn8VYw pic.twitter.com/zYdWbhuQmy,miaminewsnow,59516314,,,Fri Oct 12 18:44:04 +0000 2018
517,"The ‘Other’ Royal Wedding: Princess Eugenie, Jack Brooksbank Married At Windsor Castle http://dlvr.it/Qn7cWg pic.twitter.com/e4twld1dC4",miaminewsnow,59516314,,,Fri Oct 12 15:42:03 +0000 2018
518,$548 Million Jackpot Is Third Largest In Mega Millions History http://dlvr.it/Qn6gLM pic.twitter.com/kIXWk9Hwro,miaminewsnow,59516314,,,Fri Oct 12 12:37:04 +0000 2018
519,Lawsuit Claims Miami City Commissioner Joe Carollo Used Power To Retaliate Against Business Owners http://dlvr.it/Qn54Rp pic.twitter.com/IupIyD4Lwl,miaminewsnow,59516314,,,Fri Oct 12 06:31:03 +0000 2018
520,Ways To Help Victims Of Hurricane Michael http://dlvr.it/Qn4WSj pic.twitter.com/AVfvaD6TQG,miaminewsnow,59516314,,,Fri Oct 12 03:29:03 +0000 2018
521,Why Did Hurricane Michael Strengthen So Quickly? http://dlvr.it/Qn40y0 pic.twitter.com/S75CQO1tZg,miaminewsnow,59516314,,,Fri Oct 12 00:26:39 +0000 2018
522,Puck Drops Thursday For Florida Panthers Home Opener http://dlvr.it/Qn3N9v pic.twitter.com/CiSlYLu0ts,miaminewsnow,59516314,,,Thu Oct 11 21:25:04 +0000 2018
523,Florida Governor Rick Scott Requests Major Disaster Declaration From President Trump http://dlvr.it/QmyPHF pic.twitter.com/ZI2fQIpfJB,miaminewsnow,59516314,,,Thu Oct 11 01:42:03 +0000 2018
524,Suspects Sought In Theft Of Purse At Fort Lauderdale International Airport http://dlvr.it/QmxphB pic.twitter.com/tMZuxbH86g,miaminewsnow,59516314,,,Wed Oct 10 22:38:57 +0000 2018
525,Nationwide Earthquake Drill To Take Place Next Week http://dlvr.it/QmwDnG pic.twitter.com/Ig5vjddvNN,miaminewsnow,59516314,,,Wed Oct 10 16:32:03 +0000 2018
526,"Mega Millions, Powerball Prizes Grow To More Than $750 Million Combined http://dlvr.it/Qmp8Cs pic.twitter.com/3vNxP4LHhd",miaminewsnow,59516314,,,Tue Oct 09 16:07:04 +0000 2018
527,CBS Announces ‘The World’s Best’ In 2019 http://dlvr.it/Qmkqr3 pic.twitter.com/UhaZGTsY97,miaminewsnow,59516314,,,Tue Oct 09 03:55:04 +0000 2018
528,"New Musical “Havana Music Hall” Brings Cuban Culture, History To Life In Coral Gables http://dlvr.it/QmkKRF pic.twitter.com/8etyvsXWbV",miaminewsnow,59516314,,,Tue Oct 09 00:51:33 +0000 2018
529,"Uber, Lyft Offering Free Rides To The Polls On Election Day http://dlvr.it/Qmjk0X pic.twitter.com/E8XkxHVNv0",miaminewsnow,59516314,,,Mon Oct 08 21:48:33 +0000 2018
530,VIDEO: Northern Lights Dazzle Skies Over Arctic Circle http://dlvr.it/Qmj0tR pic.twitter.com/BqjoUFADpg,miaminewsnow,59516314,,,Mon Oct 08 18:46:05 +0000 2018
531,Police Conduct Death Investigation In North Miami Beach http://dlvr.it/Qmh6kS pic.twitter.com/yGx9wiCiYt,miaminewsnow,59516314,,,Mon Oct 08 15:42:07 +0000 2018
532,President Trump Will Be Central Florida Monday http://dlvr.it/Qmg8rf pic.twitter.com/kFMDAuoZT5,miaminewsnow,59516314,,,Mon Oct 08 12:37:41 +0000 2018
533,Facing South Florida: Opioid Crisis In Miami http://dlvr.it/QmZwdv pic.twitter.com/nwfeWGc9Q6,miaminewsnow,59516314,,,Sun Oct 07 15:18:32 +0000 2018
534,Dozens In Fort Lauderdale Protest Kavanaugh’s Confirmation http://dlvr.it/QmYCqt pic.twitter.com/PYEKHKz1Tx,miaminewsnow,59516314,,,Sun Oct 07 06:08:03 +0000 2018
535,Senate Votes To Confirm Brett Kavanaugh As Supreme Court Justice http://dlvr.it/QmWtCD pic.twitter.com/IaTT8ESYlr,miaminewsnow,59516314,,,Sat Oct 06 21:01:03 +0000 2018
536,"Hugs Can Boost Your Mood, Say Researchers http://dlvr.it/QmQWV1 pic.twitter.com/89vbKqkeQr",miaminewsnow,59516314,,,Fri Oct 05 17:32:33 +0000 2018
537,"Jumpin’ Jackpots: Mega Millions, Powerball Prizes Grow To $658 Million Combined http://dlvr.it/QmPZXq pic.twitter.com/MwKNV7KpZI",miaminewsnow,59516314,,,Fri Oct 05 14:29:04 +0000 2018
538,"8,000 Gallons Of Prosecco Lost After Wine Fermentation Tank Explodes http://dlvr.it/QmM6mL pic.twitter.com/sifWizCRq2",miaminewsnow,59516314,,,Fri Oct 05 05:19:04 +0000 2018
539,Retired Supreme Court Justice Says Kavanaugh Does Not Belong On Nation’s Highest Court http://dlvr.it/QmLbDF pic.twitter.com/f8LMXS2m6i,miaminewsnow,59516314,,,Fri Oct 05 02:17:04 +0000 2018
540,Amazon Phasing Out Pay Incentives For Some Fulfillment Center Workers http://dlvr.it/QmL0QB pic.twitter.com/L27zd2r8Rc,miaminewsnow,59516314,,,Thu Oct 04 23:14:04 +0000 2018
541,Senators Viewing Kavanaugh FBI Report In One-Hour Increments http://dlvr.it/QmKL3d pic.twitter.com/oAEXhLi0qM,miaminewsnow,59516314,,,Thu Oct 04 20:11:09 +0000 2018
542,Delta Crewmembers Transported To Hospital After Feeling Ill On Jetliner At Miami International Airport http://dlvr.it/QmJVyF pic.twitter.com/sYOx8OWDo9,miaminewsnow,59516314,,,Thu Oct 04 17:07:04 +0000 2018
543,6.5 Million Pounds Of Beef Recalled Due To Possible Salmonella Contamination http://dlvr.it/QmHVdJ pic.twitter.com/05XUnGmTom,miaminewsnow,59516314,,,Thu Oct 04 14:03:04 +0000 2018
544,Pot-Laced Brownies Brought To School; Possibly To Get Votes For Homecoming Queen http://dlvr.it/QmFlk3 pic.twitter.com/wMxzKEeDGr,miaminewsnow,59516314,,,Thu Oct 04 07:56:35 +0000 2018
545,Sarah Sanders Defends Trump’s Comments About Kavanaugh Accuser Christine Blasey Ford http://dlvr.it/QmF60g pic.twitter.com/Bt1go2lskD,miaminewsnow,59516314,,,Thu Oct 04 04:54:03 +0000 2018
546,"1 Officer Killed, 6 Others Wounded In South Carolina Shooting; Suspect In Custody http://dlvr.it/QmDZY8 pic.twitter.com/MO1YFhjM78",miaminewsnow,59516314,,,Thu Oct 04 01:50:04 +0000 2018
547,New York Tax Officials Reviewing New York Times Report On Alleged Trump Tax “Fraud” http://dlvr.it/QmD18W pic.twitter.com/VEELYg9Bbf,miaminewsnow,59516314,,,Wed Oct 03 22:47:42 +0000 2018
548,Police: Man Tried To Buy Child From Mother At Florida Walmart http://dlvr.it/Qm6269 pic.twitter.com/IRC8nsVdmJ,miaminewsnow,59516314,,,Tue Oct 02 22:18:04 +0000 2018
549,Showtime To Air ‘Shut Up And Dribble’ Docu-series In November http://dlvr.it/Qm5KxX pic.twitter.com/BEWMaHcP8n,miaminewsnow,59516314,,,Tue Oct 02 19:12:33 +0000 2018
550,Kids Of The 90s Rejoice: Classic Trix Shapes Are Back http://dlvr.it/Qm3R6V pic.twitter.com/vE7z7u5XGr,miaminewsnow,59516314,,,Tue Oct 02 13:05:37 +0000 2018
551,‘Happy Together’ Premieres Tonight At 8:30PM On CBS http://dlvr.it/Qm19RZ pic.twitter.com/S1KMbDt4Y8,miaminewsnow,59516314,,,Tue Oct 02 03:56:03 +0000 2018
552,"Fort Lauderdale Barber Pays It Forward, Giving Haircuts To The Homeless http://dlvr.it/Qm0fbF pic.twitter.com/wimT3K2xHC",miaminewsnow,59516314,,,Tue Oct 02 00:52:05 +0000 2018
553,‘The Neighborhood’ Premieres Tonight At 8PM On CBS http://dlvr.it/Qm01t5 pic.twitter.com/Gr9cMUgsLY,miaminewsnow,59516314,,,Mon Oct 01 21:48:34 +0000 2018
554,Facing South Florida: One-On-One With Gubernatorial Candidate Andrew Gillum http://dlvr.it/Qls1ry pic.twitter.com/vHuPAAMR20,miaminewsnow,59516314,,,Sun Sep 30 15:17:05 +0000 2018
555,Surveillance Video Released In Murder Of Rapper XXXTentacion http://dlvr.it/QljzL6 pic.twitter.com/sTmwqiePz5,miaminewsnow,59516314,,,Fri Sep 28 23:33:03 +0000 2018
556,Kirk Forecast To Weaken To Tropical Depression http://dlvr.it/QljMT1 pic.twitter.com/1g85pQQur7,miaminewsnow,59516314,,,Fri Sep 28 20:31:05 +0000 2018
557,Amber Alert Canceled For 2 Young Florida Children http://dlvr.it/Qlhb3S pic.twitter.com/Cc2ITiN7vR,miaminewsnow,59516314,,,Fri Sep 28 17:28:04 +0000 2018
558,Parents Paying For Kids To Learn Fortnite Dance Moves http://dlvr.it/QlgdBX pic.twitter.com/PGSZ8qkrtD,miaminewsnow,59516314,,,Fri Sep 28 14:26:04 +0000 2018
559,"Broward Tourism VP Steered $255,000 To Boyfriend, Investigation Reveals http://dlvr.it/Qlfk5n pic.twitter.com/5xJ8KDfdFC",miaminewsnow,59516314,,,Fri Sep 28 11:24:06 +0000 2018
560,Florida Dog Electrocuted By Utility Box Lid During Routine Walk http://dlvr.it/Qldsp7 pic.twitter.com/JXViA0vgvt,miaminewsnow,59516314,,,Fri Sep 28 08:20:04 +0000 2018
561,Dueling Lottery Jackpots Rise To Nearly $550 Million http://dlvr.it/QldBtB pic.twitter.com/xuy5TdlKSS,miaminewsnow,59516314,,,Fri Sep 28 05:18:05 +0000 2018
562,"Brett Kavanaugh, Christine Blasey Ford Testify Before Senate Judiciary Committee http://dlvr.it/Qlcdpv pic.twitter.com/oe3s2ec4WW",miaminewsnow,59516314,,,Fri Sep 28 02:13:04 +0000 2018
563,Ultra Music Festival Leaving Bayfront Park After Unanimous Commission Vote http://dlvr.it/Qlc3Gm pic.twitter.com/m0fwq0xepq,miaminewsnow,59516314,,,Thu Sep 27 23:07:34 +0000 2018
564,Coral Springs Police Arrest Twins Gymnasium Volunteer For Lewd Lascivious Molestation http://dlvr.it/QlbLPm pic.twitter.com/ENpZiUKGNC,miaminewsnow,59516314,,,Thu Sep 27 20:03:05 +0000 2018
565,Police: Hollywood Peeping Tom May Be Same Man Sought In Miami Gardens http://dlvr.it/QlZTsm pic.twitter.com/DKicq1Zz3k,miaminewsnow,59516314,,,Thu Sep 27 17:01:05 +0000 2018
566,Meat Recalled For E.Coli Found At Grocery Stores Nationwide http://dlvr.it/QlVzh4 pic.twitter.com/PzO4Hh9Ahk,miaminewsnow,59516314,,,Thu Sep 27 04:49:03 +0000 2018
567,Senate Judiciary Committee Asked Kavanaugh About 2 New Claims Of Sexual Assault http://dlvr.it/QlVS2c pic.twitter.com/t9RD04zeCt,miaminewsnow,59516314,,,Thu Sep 27 01:46:02 +0000 2018
568,Angry Father Of Teen Voyeurism Victim: “They Need To Get Him Off The Streets” http://dlvr.it/QlTtQk pic.twitter.com/W3UjKe9kys,miaminewsnow,59516314,,,Wed Sep 26 22:44:04 +0000 2018
569,Drones Being Used To Search For Runaway Kangaroo In Florida http://dlvr.it/QlT96f pic.twitter.com/6ZlF85co1h,miaminewsnow,59516314,,,Wed Sep 26 19:41:03 +0000 2018
570,Avenatti Client Says Brett Kavanaugh Was Present While She Was “Gang Raped” During High School http://dlvr.it/QlSJ2r pic.twitter.com/5iAht0O8Kl,miaminewsnow,59516314,,,Wed Sep 26 16:36:33 +0000 2018
571,Lauren’s List Breaks Down Basic Computer Mistakes We All Make http://dlvr.it/QlRFMy pic.twitter.com/L9XRk6dktb,miaminewsnow,59516314,,,Wed Sep 26 13:31:04 +0000 2018
572,"JLo, Alex Rodriguez Among Notables In Attendance At Buoniconti Fund Gala http://dlvr.it/QlNKsy pic.twitter.com/a8rk1yipMB",miaminewsnow,59516314,,,Wed Sep 26 01:19:38 +0000 2018
573,Police Searching For Missing Teen From Miami Gardens http://dlvr.it/QlMkjd pic.twitter.com/In6njnwcLZ,miaminewsnow,59516314,,,Tue Sep 25 22:15:32 +0000 2018
574,Bill Cosby Sentenced To 3-10 Years Behind Bars For Sexual Assault http://dlvr.it/QlM0wQ pic.twitter.com/UpQ1sX1BS5,miaminewsnow,59516314,,,Tue Sep 25 19:12:04 +0000 2018
575,"‘He’s Always There For You’: Teen On Mentor, Coach With Passion For Tennis & His Students http://dlvr.it/QlL7mb pic.twitter.com/Xgebyh893U",miaminewsnow,59516314,,,Tue Sep 25 16:09:32 +0000 2018
576,Fore! A Round Of Golf Is Good For Your Health http://dlvr.it/QlGpxJ pic.twitter.com/Qb3GFgCtz5,miaminewsnow,59516314,,,Tue Sep 25 03:57:54 +0000 2018
577,‘Building Beauty From The Inside Out’: Gem Facial Expert On Hot Trend In Skin Care http://dlvr.it/QlGHyl pic.twitter.com/YRbW4yinRA,miaminewsnow,59516314,,,Tue Sep 25 00:54:40 +0000 2018
578,Dueling Lottery Jackpots Rise To Nearly $500 Million http://dlvr.it/QlFjGG pic.twitter.com/xibxvGwPuZ,miaminewsnow,59516314,,,Mon Sep 24 21:52:40 +0000 2018
579,Stay In A Coffin For 30 Hours And Win Big? Six Flags Rolls Out Challenge http://dlvr.it/QlF0Nn pic.twitter.com/tJK3B5wA5k,miaminewsnow,59516314,,,Mon Sep 24 18:50:06 +0000 2018
580,"Florida Sheriff’s Deputy Kills Wife, Self http://dlvr.it/QlD6V7 pic.twitter.com/qyO2eiSSBW",miaminewsnow,59516314,,,Mon Sep 24 15:48:05 +0000 2018
581,Tropical Depression Kirk Barreling West Across The Atlantic http://dlvr.it/QlC5v9 pic.twitter.com/LURM1dxb97,miaminewsnow,59516314,,,Mon Sep 24 12:42:33 +0000 2018
582,Senate Judiciary Committee And Kavanaugh Accuser Reach Agreement For Testimony http://dlvr.it/Ql7QNB pic.twitter.com/dC5AYkqZRg,miaminewsnow,59516314,,,Sun Sep 23 18:25:04 +0000 2018
583,Facing South Florida: Discussing Gubernatorial Race With Ron DeSantis & Jeanette Nunez http://dlvr.it/Ql6m8Z pic.twitter.com/IxeMd4GPl7,miaminewsnow,59516314,,,Sun Sep 23 15:22:05 +0000 2018
584,"Panthers DE Julius Peppers Starts Hurricane Florence Relief Fund, Donates $100K http://dlvr.it/Ql07Mj pic.twitter.com/Ja840TSo45",miaminewsnow,59516314,,,Sat Sep 22 02:45:03 +0000 2018
585,NASA’s Planet-Hunting Telescope Discovers Two Distant Planets http://dlvr.it/Qkzbxg pic.twitter.com/It1sBYf7Yj,miaminewsnow,59516314,,,Fri Sep 21 23:42:03 +0000 2018
586,‘Look At The Size Of This Thing’: Waverunner Tour Guide On Rare Saltwater Run-In With Crocodile (Or Gator) http://dlvr.it/Qkyy5Z pic.twitter.com/cYYqJYEyoy,miaminewsnow,59516314,,,Fri Sep 21 20:38:04 +0000 2018
587,"Several People Stabbed, Including 3 Infants, At Day Care In Queens http://dlvr.it/Qkx9Q5 pic.twitter.com/RgIwA6ZPRR",miaminewsnow,59516314,,,Fri Sep 21 14:33:04 +0000 2018
588,"Move Over Summer, Here Comes The Fall Equinox http://dlvr.it/QktjB9 pic.twitter.com/glZpiaEKrF",miaminewsnow,59516314,,,Fri Sep 21 05:22:05 +0000 2018
589,Viral McDonald’s Pranksters Rewarded With Big Check http://dlvr.it/Qkt9TB pic.twitter.com/cr2Me9ESlY,miaminewsnow,59516314,,,Fri Sep 21 02:18:03 +0000 2018
590,Jury To Decide If Woman Run Over By Ocean Rescue Truck Will Be Awarded Compensation http://dlvr.it/QksbtB pic.twitter.com/eNRxBZ00iU,miaminewsnow,59516314,,,Thu Sep 20 23:15:05 +0000 2018
591,Mega Millions Jackpot On The Rise Again To $275 Million http://dlvr.it/Qkrvb9 pic.twitter.com/cwvI7tczAN,miaminewsnow,59516314,,,Thu Sep 20 20:12:03 +0000 2018
592,Student Pilot Causes Security Breach At Orlando Melbourne International Airport http://dlvr.it/Qkq1Xx pic.twitter.com/5Utv7Oa5J9,miaminewsnow,59516314,,,Thu Sep 20 14:05:02 +0000 2018
593,Trump Says It Would Be “Wonderful” If Kavanaugh Accuser Shows For Hearing http://dlvr.it/Qkmbbx pic.twitter.com/jGwONieifW,miaminewsnow,59516314,,,Thu Sep 20 04:54:04 +0000 2018
594,"Needle Disposal Area Included, Ribbon-Cutting Ceremony Held For First Public Bathroom In Downtown Miami http://dlvr.it/Qkm2rQ pic.twitter.com/quK01l54tb",miaminewsnow,59516314,,,Thu Sep 20 01:51:44 +0000 2018
595,"BSO, Tamarac Fire Rescue Practice Response To Active-Shooter Situations http://dlvr.it/QklQj6 pic.twitter.com/qoF3MBlUPe",miaminewsnow,59516314,,,Wed Sep 19 22:49:02 +0000 2018
596,Maine Restaurant Sedates Lobsters With Marijuana Before Cooking Them http://dlvr.it/QkkZyK pic.twitter.com/G6Yfj2wJlH,miaminewsnow,59516314,,,Wed Sep 19 19:46:33 +0000 2018
597,UCF Linebacker Accused Of Rape http://dlvr.it/Qkjjnw pic.twitter.com/Rplf0ftl5C,miaminewsnow,59516314,,,Wed Sep 19 16:43:03 +0000 2018
