Tweet,User,User_ID,Geo,HashTag,Date
297,Report: Broward Schools Hire New Chief Of Security http://dlvr.it/QymFVf pic.twitter.com/2WXStMzSRG,miaminewsnow,59516314,,,Tue Feb 12 22:50:33 +0000 2019
298,Pot Smokers Find Tiger In Abandoned Home In Houston http://dlvr.it/Qylhlm pic.twitter.com/bn5qZG39Zf,miaminewsnow,59516314,,,Tue Feb 12 19:48:02 +0000 2019
299,Hollywood Police Investigating Possible Kidnapping Of Young Girl http://dlvr.it/Qyl3dB pic.twitter.com/gucjRpvNb7,miaminewsnow,59516314,,,Tue Feb 12 16:49:03 +0000 2019
300,Coast Guard Calls Off Search For Plane Captain After Crash In Ocean Waters http://dlvr.it/QycC0Y pic.twitter.com/RfsvEJxYTN,miaminewsnow,59516314,,,Sun Feb 10 22:39:03 +0000 2019
301,Miami Super Bowl Host Committee Releases 100 Specialty Hospitality Packages http://dlvr.it/QyVpnB pic.twitter.com/x0GpFEFXwz,miaminewsnow,59516314,,,Sat Feb 09 01:26:03 +0000 2019
302,Zoo Miami’s Young Pygmy Hippo Undergoes Medical Exam http://dlvr.it/QyVPvf pic.twitter.com/9mezx6Mar8,miaminewsnow,59516314,,,Fri Feb 08 22:25:03 +0000 2019
303,CBS4’s Lauren Pastrana & Family Featured In ‘Miami Kids Magazine’ http://dlvr.it/QyTJHj pic.twitter.com/Doct2AtvU4,miaminewsnow,59516314,,,Fri Feb 08 16:24:32 +0000 2019
304,Fifth Donor Found For Young Miami Girl Battling Cancer With Rare Blood Type http://dlvr.it/QyQvks pic.twitter.com/2ehJ8dTGQk,miaminewsnow,59516314,,,Fri Feb 08 01:20:03 +0000 2019
305,Gov. DeSantis Announces $422 Million To Bolster Best And Brightest Teachers Program http://dlvr.it/QyPtKr pic.twitter.com/pUMqdBFG60,miaminewsnow,59516314,,,Thu Feb 07 19:14:34 +0000 2019
306,Legendary Supermodel Elle Macpherson Featured On Latest Ocean Drive Magazine Cover http://dlvr.it/QyLkxs pic.twitter.com/q1etAZPy0z,miaminewsnow,59516314,,,Thu Feb 07 01:08:03 +0000 2019
307,Man Accused Of Touching Himself In Front Of Teen At Dunkin Donuts http://dlvr.it/QyKk06 pic.twitter.com/DxqU43JaEb,miaminewsnow,59516314,,,Wed Feb 06 19:08:03 +0000 2019
308,Former Margate Commissioner Convicted Of Public Corruption http://dlvr.it/QyFdy9 pic.twitter.com/WvtJnaPoaC,miaminewsnow,59516314,,,Tue Feb 05 18:57:03 +0000 2019
309,Police Searching For Student Who May Be Armed With A Knife At Piper High http://dlvr.it/Qy9dsD pic.twitter.com/YzoiPImH3J,miaminewsnow,59516314,,,Mon Feb 04 18:52:34 +0000 2019
310,CBD And Hemp Oil For Pets http://dlvr.it/Qy91Gn pic.twitter.com/8PkEkcqAVp,miaminewsnow,59516314,,,Mon Feb 04 15:51:32 +0000 2019
311,Police ID Man Accused Of Killing Dog With Sledgehammer http://dlvr.it/Qy8Nql pic.twitter.com/giUP83fXjA,miaminewsnow,59516314,,,Mon Feb 04 12:52:03 +0000 2019
312,Fatal Crash Involving 2 Vehicles On I-595 In Davie http://dlvr.it/Qy61nv pic.twitter.com/6PxZSOUH8J,miaminewsnow,59516314,,,Sun Feb 03 18:49:33 +0000 2019
313,Facing South Florida: Congressman Ted Deutch http://dlvr.it/Qy5bWX pic.twitter.com/dcd7py7SBw,miaminewsnow,59516314,,,Sun Feb 03 15:50:02 +0000 2019
314,Triple Shooting Erupts During Lauderhill Apartment Function http://dlvr.it/Qy5Bp2 pic.twitter.com/3XrWJrJzDx,miaminewsnow,59516314,,,Sun Feb 03 12:49:33 +0000 2019
315,"Police Search For Man, 2 Minor Children In ‘Parental Abduction’ http://dlvr.it/Qy10D2 pic.twitter.com/Atjhu4oeeA",miaminewsnow,59516314,,,Sat Feb 02 00:34:02 +0000 2019
316,‘The World’s Best’ Coming To CBS Following Super Bowl LIII http://dlvr.it/Qy0Y4L pic.twitter.com/WwtMJy2fxh,miaminewsnow,59516314,,,Fri Feb 01 21:32:02 +0000 2019
317,"Coast Guard Captures 2 Suspected Drug smugglers, 132 Pounds Of Cocaine Off Haulover Inlet http://dlvr.it/Qxzzxx pic.twitter.com/O3WQkM2670",miaminewsnow,59516314,,,Fri Feb 01 18:30:05 +0000 2019
318,"Women Accused Of Stealing Rolex Watch, $5K In Cash From Tourist http://dlvr.it/QxwQDZ pic.twitter.com/iGM4H9U91u",miaminewsnow,59516314,,,Thu Jan 31 21:23:05 +0000 2019
319,Recall Of Infant Ibuprofen Oral Suspension Drops Expanded http://dlvr.it/Qxv7SW pic.twitter.com/lVHc7XREuF,miaminewsnow,59516314,,,Thu Jan 31 15:20:04 +0000 2019
320,Gunshot Victim Holds Down Shooter Until Miami Police Arrive http://dlvr.it/Qxs5Rg pic.twitter.com/t3yV1MKLLC,miaminewsnow,59516314,,,Thu Jan 31 03:20:06 +0000 2019
321,Chilly Start But Warming Up This Afternoon http://dlvr.it/Qxpzdt pic.twitter.com/uceoS01tQC,miaminewsnow,59516314,,,Wed Jan 30 15:18:33 +0000 2019
322,Scott Israel Seeking Senate Hearing In Attempt To Reclaim Job As Broward Sheriff http://dlvr.it/QxmbyZ pic.twitter.com/pzyOdQISA6,miaminewsnow,59516314,,,Wed Jan 30 00:12:34 +0000 2019
323,Test Miami Proud http://dlvr.it/Qxhpy3 pic.twitter.com/cKjBTVAlu3,miaminewsnow,59516314,,,Tue Jan 29 03:03:03 +0000 2019
324,Police Need Help In Finding Missing Miami Teens http://dlvr.it/QxhRvR pic.twitter.com/izqOgaix3P,miaminewsnow,59516314,,,Tue Jan 29 00:01:05 +0000 2019
325,Bling Still For Sale Despite Truck Crashing Through Jewelry Store http://dlvr.it/Qxc8n6 pic.twitter.com/xOdENrZ1Gr,miaminewsnow,59516314,,,Sun Jan 27 20:51:34 +0000 2019
326,Facing South Florida: Jim DeFede’s Insight Into Arrest Of Roger Stone http://dlvr.it/Qxbkmj pic.twitter.com/8rHhlRjtpl,miaminewsnow,59516314,,,Sun Jan 27 17:50:34 +0000 2019
327,Stream The Farmers Insurance Open http://dlvr.it/QxVjmY pic.twitter.com/MpYP5vRFxQ,miaminewsnow,59516314,,,Fri Jan 25 23:29:06 +0000 2019
328,Heroes Among Us: “I Was Proud To Serve’: World War II Veteran Salvatore Esposito http://dlvr.it/QxSy4h pic.twitter.com/WMxZ0oM28r,miaminewsnow,59516314,,,Fri Jan 25 14:28:04 +0000 2019
329,"Woman Shot After Performing Sexual Act For $5, Pringles Potato Chips http://dlvr.it/QxGMNf pic.twitter.com/iSNOk6YoiC",miaminewsnow,59516314,,,Tue Jan 22 23:00:33 +0000 2019
330,Gov. DeSantis Appoints Third State Supreme Court Justice http://dlvr.it/QxFBKf pic.twitter.com/z7Fvm2MeDL,miaminewsnow,59516314,,,Tue Jan 22 16:58:34 +0000 2019
331,Florida Lottery Gold Rush Classic Word Of The Day http://dlvr.it/QxBG8j pic.twitter.com/UHa3HUmAQU,miaminewsnow,59516314,,,Mon Jan 21 22:51:04 +0000 2019
332,Facing South Florida: State Senator Gary Farmer On Medical Marijuana http://dlvr.it/Qx62Kd pic.twitter.com/czwmeAa1T0,miaminewsnow,59516314,,,Sun Jan 20 19:35:05 +0000 2019
333,Facing South Florida: Affordable Housing Crisis http://dlvr.it/Qx5b5W pic.twitter.com/8TGQRZJ4rb,miaminewsnow,59516314,,,Sun Jan 20 16:34:04 +0000 2019
334,Get ‘Lucky’ At Chef Norman Van Aken’s ‘Three’ In Today’s Digital Bite http://dlvr.it/Qx394D pic.twitter.com/2yq9av5RKj,miaminewsnow,59516314,,,Sat Jan 19 19:28:05 +0000 2019
335,‘Traveling Bandit’ Bank Robber Started 6 State Crime Spree In South Florida http://dlvr.it/Qx0Nvw pic.twitter.com/EwAqc0YOvo,miaminewsnow,59516314,,,Fri Jan 18 22:21:04 +0000 2019
336,Perdue Recalls Simply Smart Organics Gluten Free Chicken Breast Nuggets http://dlvr.it/QwzqyP pic.twitter.com/g46Vvy9UKX,miaminewsnow,59516314,,,Fri Jan 18 19:19:05 +0000 2019
337,Coyotes Spotted Roaming Oakland Park Golf Course http://dlvr.it/QwwBCS pic.twitter.com/nD7gCcEn9Z,miaminewsnow,59516314,,,Thu Jan 17 22:11:04 +0000 2019
338,Miami Northwestern Senior High School Student Accused Of Exposing Himself To Teacher http://dlvr.it/QwqwWn pic.twitter.com/sQ7ULAtZIB,miaminewsnow,59516314,,,Wed Jan 16 22:01:03 +0000 2019
339,"‘Get Out Of Here, You Clown’: Florida Homeowner Foils Burglary With Two-Way Talk Camera http://dlvr.it/QwmB4d pic.twitter.com/rVZeEmGep6",miaminewsnow,59516314,,,Wed Jan 16 00:57:04 +0000 2019
340,Large Water Main Break Affecting Traffic In Broward http://dlvr.it/QwljRh pic.twitter.com/gB8YdlBXEm,miaminewsnow,59516314,,,Tue Jan 15 21:52:03 +0000 2019
341,South Florida Enjoying Another Dip In Degrees This Week http://dlvr.it/QwgXpJ pic.twitter.com/FEPbGlVyqm,miaminewsnow,59516314,,,Mon Jan 14 21:24:05 +0000 2019
342,Federal Workers In Limbo As Government Shutdown Hits Day 24 http://dlvr.it/Qwfyqv pic.twitter.com/RD0YkEM6iB,miaminewsnow,59516314,,,Mon Jan 14 18:21:05 +0000 2019
343,Guests Evacuated From Seminole Hard Rock Hotel In Hollywood After Gas Leak http://dlvr.it/QwfHBj pic.twitter.com/ulpj6fJ0LH,miaminewsnow,59516314,,,Mon Jan 14 15:17:33 +0000 2019
344,Crackdown On Credit Card Skimmers At South Florida Gas Pumps http://dlvr.it/QwblfP pic.twitter.com/abMhX6LGtd,miaminewsnow,59516314,,,Sun Jan 13 21:20:04 +0000 2019
345,Facing South Florida: Latest On The Government Shutdown http://dlvr.it/QwbKsr pic.twitter.com/nnf4y3HEQb,miaminewsnow,59516314,,,Sun Jan 13 18:17:05 +0000 2019
346,Facing South Florida: Governor Ron DeSantis Suspends Broward Sheriff Scott Israel http://dlvr.it/QwZt58 pic.twitter.com/0X0DwIFksl,miaminewsnow,59516314,,,Sun Jan 13 15:15:07 +0000 2019
347,Digital Bite Serves Up Octopus A La Plancha From Dune In Fort Lauderdale http://dlvr.it/QwXSQj pic.twitter.com/HcBfpgOgkU,miaminewsnow,59516314,,,Sat Jan 12 17:51:04 +0000 2019
348,"Sheriff: Jayme Closs Found Alive In Wisconsin, Suspect Arrested http://dlvr.it/QwTh3v pic.twitter.com/bL35M4d9b9",miaminewsnow,59516314,,,Fri Jan 11 20:32:34 +0000 2019
349,Hollywood Police Asking For Help In Finding A Pair Of Carjackers http://dlvr.it/QwQcy2 pic.twitter.com/uckFLqlDCC,miaminewsnow,59516314,,,Fri Jan 11 02:59:05 +0000 2019
350,It’s Going To Cost You More To Mail A Letter http://dlvr.it/QwQD6P pic.twitter.com/eGllqsmYgs,miaminewsnow,59516314,,,Thu Jan 10 23:44:34 +0000 2019
351,Two Men Sue After Being Cited For Feeding Homeless http://dlvr.it/QwPhHB pic.twitter.com/9mrtMutv6q,miaminewsnow,59516314,,,Thu Jan 10 20:29:07 +0000 2019
352,Nina Dobrev Joins CBS ‘FAM’ This Thursday http://dlvr.it/QwLW4X pic.twitter.com/Gk7VtZ0pQa,miaminewsnow,59516314,,,Thu Jan 10 02:28:05 +0000 2019
353,"WATCH: Freeway Sign Suddenly Falls, Slamming Into Unsuspecting Car http://dlvr.it/QwL5jx pic.twitter.com/3b1rHnVi1j",miaminewsnow,59516314,,,Wed Jan 09 23:18:37 +0000 2019
354,Nate Burleson: Vander Esch & Smith Will Determine If Cowboys Win Or Fall Short Against Rams http://dlvr.it/QwJvNn pic.twitter.com/se06biFpXk,miaminewsnow,59516314,,,Wed Jan 09 17:06:04 +0000 2019
355,Lake Worth Woman Reportedly Attacked Parents For Not Taking Her To Outback http://dlvr.it/QwGMbJ pic.twitter.com/91AkikTaZ9,miaminewsnow,59516314,,,Wed Jan 09 02:21:34 +0000 2019
356,Trespasser Caught On Camera Licking Doorbell http://dlvr.it/QwFxrP pic.twitter.com/0rKM2qJ2MT,miaminewsnow,59516314,,,Tue Jan 08 23:12:38 +0000 2019
357,Caught On Camera: Miami Police Cruiser Slams Into Self Storage Building http://dlvr.it/QwDlZC pic.twitter.com/yzQyUS1sZI,miaminewsnow,59516314,,,Tue Jan 08 17:01:41 +0000 2019
358,Man Denies Ownership Of Syringes Retrieved From Rectum http://dlvr.it/QwBDQT pic.twitter.com/u1824kAaYP,miaminewsnow,59516314,,,Tue Jan 08 02:11:04 +0000 2019
359,"Local TSA Employees Impacted By Government Shutdown Still Going To Work, For Now http://dlvr.it/Qw9qCm pic.twitter.com/PlO9dPR9zW",miaminewsnow,59516314,,,Mon Jan 07 23:06:33 +0000 2019
360,Get Hired At Mega Job Fair In Miami Lakes http://dlvr.it/Qw8dv8 pic.twitter.com/VvcDu7pUbU,miaminewsnow,59516314,,,Mon Jan 07 16:57:03 +0000 2019
361,High-Powered Rifle Used In Early Morning Armed Robbery http://dlvr.it/Qw5Pq5 pic.twitter.com/5qqPj6bekR,miaminewsnow,59516314,,,Sun Jan 06 19:14:03 +0000 2019
362,South Florida 11-Year-Old With Autism Is A Revelation On The Piano http://dlvr.it/QvwSND pic.twitter.com/VNWJqIR01p,miaminewsnow,59516314,,,Thu Jan 03 23:50:35 +0000 2019
363,Massive Alligator Caught Taking A Leisurely Stroll In Central Florida Reserve http://dlvr.it/QvvzHL pic.twitter.com/k9Nn9ZQEJp,miaminewsnow,59516314,,,Thu Jan 03 20:43:05 +0000 2019
364,Miramar Woman’s Disappearance Investigated As Murder http://dlvr.it/QvvMYc pic.twitter.com/k2ag68t4t1,miaminewsnow,59516314,,,Thu Jan 03 17:37:05 +0000 2019
365,Family Of WWII Navy Vet Reaches Out For Help On New Roof http://dlvr.it/QvrYcK pic.twitter.com/k24hwaEhhV,miaminewsnow,59516314,,,Wed Jan 02 23:39:02 +0000 2019
366,Police: Man Shoots Up Taco Bell Over Hot Sauce Snafu http://dlvr.it/Qvr4ZN pic.twitter.com/M5cy2eg4Rv,miaminewsnow,59516314,,,Wed Jan 02 20:35:03 +0000 2019
367,Safe Stolen In Cutler Bay T-Mobile Smash & Grab http://dlvr.it/QvqV8s pic.twitter.com/PLU2dly7an,miaminewsnow,59516314,,,Wed Jan 02 17:31:04 +0000 2019
368,South Florida’s Hospitals Welcome First Newborns Of The Year http://dlvr.it/Qvm4xW pic.twitter.com/ZAP8mGYnp1,miaminewsnow,59516314,,,Tue Jan 01 16:44:03 +0000 2019
369,Mega Millions Jackpot At $425 Million For New Year’s Day Drawing http://dlvr.it/Qvlg9K pic.twitter.com/nm3yboUQQa,miaminewsnow,59516314,,,Tue Jan 01 13:37:32 +0000 2019
370,Bank Robbery Suspect Sought In Aventura http://dlvr.it/QvjgdM pic.twitter.com/MpIkjZQmxn,miaminewsnow,59516314,,,Mon Dec 31 19:05:03 +0000 2018
371,Man Injured In Miami Shooting Behind Auto Parts Store http://dlvr.it/QvhgfG pic.twitter.com/LuPi0edErn,miaminewsnow,59516314,,,Mon Dec 31 12:55:03 +0000 2018
372,Drunk Driver Arrested After Slamming Into Miami Gardens Police Cruiser http://dlvr.it/Qvf5St pic.twitter.com/Kt6hU9pUgY,miaminewsnow,59516314,,,Sun Dec 30 15:19:04 +0000 2018
373,Child In Critical Condition After Falling From 4th-Floor Balcony In Lauderhill http://dlvr.it/QvYXCK pic.twitter.com/GUVJiZNvFh,miaminewsnow,59516314,,,Fri Dec 28 23:09:05 +0000 2018
374,Artist Recreates Face Based On Skull Found In Key Biscayne Park http://dlvr.it/QvTpnv pic.twitter.com/HBechoUzW8,miaminewsnow,59516314,,,Thu Dec 27 22:22:03 +0000 2018
375,‘Holy Cows’ Assemble To Form Cross On Christmas Day http://dlvr.it/QvTKXZ pic.twitter.com/CNjFHvgLOd,miaminewsnow,59516314,,,Thu Dec 27 19:17:05 +0000 2018
376,Ft. Lauderdale Man May Have Been Targeted For Murder In Gas Station Shooting http://dlvr.it/QvSk00 pic.twitter.com/zz9meF0roO,miaminewsnow,59516314,,,Thu Dec 27 16:12:05 +0000 2018
377,Davie Police Ask For Public’s Help In Identifying Criminals http://dlvr.it/QvQC06 pic.twitter.com/uCyGwWsgE5,miaminewsnow,59516314,,,Wed Dec 26 22:19:36 +0000 2018
378,Christmas Mega Millions Jackpot Rolling Over http://dlvr.it/QvPjfq pic.twitter.com/2IafDZMbkb,miaminewsnow,59516314,,,Wed Dec 26 19:15:05 +0000 2018
379,Coast Guard Searching For Missing Man On Personal Watercraft Off Marathon http://dlvr.it/QvP7K5 pic.twitter.com/3Sf8z40FYe,miaminewsnow,59516314,,,Wed Dec 26 16:07:35 +0000 2018
380,$321 Million Jackpot In Mega Millions Christmas Night Drawing http://dlvr.it/QvJWHv pic.twitter.com/lhp7UUqgbA,miaminewsnow,59516314,,,Tue Dec 25 00:27:03 +0000 2018
381,"Kevin Spacey charged with sexual assault, posts video statement as Frank Underwood http://dlvr.it/QvJBz4 pic.twitter.com/kTFCAOxXuJ",miaminewsnow,59516314,,,Mon Dec 24 21:25:05 +0000 2018
382,Suspected Business Burglars Busted In Doral http://dlvr.it/QvHlts pic.twitter.com/CQHITLom5S,miaminewsnow,59516314,,,Mon Dec 24 18:22:04 +0000 2018
383,4 People Injured After Balcony Collapses In Miami Beach http://dlvr.it/QvDdRL pic.twitter.com/efvPmcI11A,miaminewsnow,59516314,,,Sun Dec 23 17:54:34 +0000 2018
384,"Brenda Snipes, Rick Scott To Square Off In Federal Court http://dlvr.it/QvD9S4 pic.twitter.com/IRmMTXbBrq",miaminewsnow,59516314,,,Sun Dec 23 14:50:32 +0000 2018
385,Reported Shooting Investigated At Pembroke Lakes Mall http://dlvr.it/Qv7wq5 pic.twitter.com/ndaNcUDIa8,miaminewsnow,59516314,,,Sat Dec 22 02:16:04 +0000 2018
386,Broward Sheriff’s Deputy Involved In Three-Vehicle Crash http://dlvr.it/Qv4Jt0 pic.twitter.com/4u7qCf4kPO,miaminewsnow,59516314,,,Fri Dec 21 04:54:03 +0000 2018
387,"Officers Pretend To Break Up Flash Mob, Join Dance Routine In Aventura Mall http://dlvr.it/Qv3b97 pic.twitter.com/Yf7Gz16Rvg",miaminewsnow,59516314,,,Thu Dec 20 22:45:04 +0000 2018
388,Watch: Delivery Driver Busts Out The Dance Moves On The Front Porch http://dlvr.it/Qv33Nt pic.twitter.com/oBt6W7vHnr,miaminewsnow,59516314,,,Thu Dec 20 19:41:04 +0000 2018
389,Nine Arrests In Connection With Vicious Black Bear Abuse In Florida http://dlvr.it/Qtztqk pic.twitter.com/eFTSA35BkZ,miaminewsnow,59516314,,,Thu Dec 20 01:45:03 +0000 2018
390,WATCH: Student Body Slammed By Deputy After Stealing Candy Bar From Vending Machine http://dlvr.it/QtzRpD pic.twitter.com/qFgU7SUx4o,miaminewsnow,59516314,,,Wed Dec 19 22:43:03 +0000 2018
391,Minimum Wage Set To Increase In Florida In 2019 http://dlvr.it/QtyF34 pic.twitter.com/FWjl0Ck5Nc,miaminewsnow,59516314,,,Wed Dec 19 16:36:04 +0000 2018
392,Holiday Homes: The Kramer Family http://dlvr.it/QtvgC5 pic.twitter.com/EeXeDCakOU,miaminewsnow,59516314,,,Wed Dec 19 01:21:54 +0000 2018
393,Deserving Children Get Early Gifts During ‘Shop With A Cop’ Event In Miami http://dlvr.it/QtvCS9 pic.twitter.com/J9R6zhKHss,miaminewsnow,59516314,,,Tue Dec 18 22:18:03 +0000 2018
394,CBS Board: Les Moonves Will Not Receive $120 Million Severance http://dlvr.it/QtqT52 pic.twitter.com/TcsOuFMr6y,miaminewsnow,59516314,,,Tue Dec 18 00:56:04 +0000 2018
395,Endangered Leatherback Sea Turtle Freed From Keys Lobster Trap Lines http://dlvr.it/QtpRzV pic.twitter.com/cz2fQC6ZHJ,miaminewsnow,59516314,,,Mon Dec 17 18:49:03 +0000 2018
396,Police Warn Of Scammers Posing As Netflix To Gain Personal Information http://dlvr.it/QtnpHv pic.twitter.com/rKOQl3DEvB,miaminewsnow,59516314,,,Mon Dec 17 15:47:04 +0000 2018
397,Facing South Florida: MSD Commission Draft Report http://dlvr.it/QtlBSL pic.twitter.com/7XAEU4AyHT,miaminewsnow,59516314,,,Sun Dec 16 21:51:03 +0000 2018
398,Facing South Florida: Farewell Congresswoman Ileana Ros-Lehtinen http://dlvr.it/QtkmZ4 pic.twitter.com/UB7dgBjixk,miaminewsnow,59516314,,,Sun Dec 16 18:47:03 +0000 2018
399,Focus On South Florida: Holiday Depression And Stress http://dlvr.it/QtkKKr pic.twitter.com/aj8GWTBh5f,miaminewsnow,59516314,,,Sun Dec 16 15:43:03 +0000 2018
400,"FIU Football Player Arrested, Facing Domestic Battery Charges http://dlvr.it/Qtdjwj pic.twitter.com/nDusvuw4J3",miaminewsnow,59516314,,,Fri Dec 14 23:58:04 +0000 2018
401,Police: Hollywood Burglar Also Sexually Battered Victim http://dlvr.it/QtdGhD pic.twitter.com/Sfx1yf6MZB,miaminewsnow,59516314,,,Fri Dec 14 20:55:05 +0000 2018
402,"Family Offering To Pay Photographer Over $90,000 To Take Photos Of Them Traveling The World http://dlvr.it/QtchqK pic.twitter.com/evDeNkboqQ",miaminewsnow,59516314,,,Fri Dec 14 17:51:56 +0000 2018
403,Police Searching For Burglar In Hollywood Who Sexually Battered Victim http://dlvr.it/QtYtv6 pic.twitter.com/dPci1Q2Www,miaminewsnow,59516314,,,Thu Dec 13 23:57:04 +0000 2018
404,WATCH: Special Needs High School Student Shocked By Surprise Gift http://dlvr.it/QtYQ5K pic.twitter.com/k6PudtLQ9t,miaminewsnow,59516314,,,Thu Dec 13 20:53:05 +0000 2018
405,Active Search Underway In Hallandale Beach In Connection To Missing Person Cold Case http://dlvr.it/QtXpKS pic.twitter.com/qQGX83ENGK,miaminewsnow,59516314,,,Thu Dec 13 17:48:03 +0000 2018
406,New Mom Straps On Baby To Wait Tables During Snowstorm http://dlvr.it/QtV0cv pic.twitter.com/jAA3O42EFz,miaminewsnow,59516314,,,Wed Dec 12 23:50:03 +0000 2018
407,Police: Couple Accused Of Force Feeding Batteries To A Child http://dlvr.it/QtTZHT pic.twitter.com/4BOuN7TgjK,miaminewsnow,59516314,,,Wed Dec 12 20:47:05 +0000 2018
408,Michael Cohen Sentenced To 3 years In Prison http://dlvr.it/QtSwMv pic.twitter.com/yX2ImLpLs7,miaminewsnow,59516314,,,Wed Dec 12 17:45:06 +0000 2018
409,15 Disney Guests Treated Following Bus Crash At Epcot http://dlvr.it/QtP0rG pic.twitter.com/KnvVEFa5TR,miaminewsnow,59516314,,,Tue Dec 11 20:20:03 +0000 2018
410,Florida Man Arrested For Shoplifting At Kohl’s After Job Interview http://dlvr.it/QtNJ6M pic.twitter.com/i7AKhadUwq,miaminewsnow,59516314,,,Tue Dec 11 17:18:03 +0000 2018
411,Florida Lottery Holiday Bonus Watch & Win http://dlvr.it/QtKMSx pic.twitter.com/s9K4QqMAeI,miaminewsnow,59516314,,,Tue Dec 11 02:01:04 +0000 2018
412,Three Hurt In Opa-locka Shooting http://dlvr.it/QtBFy9 pic.twitter.com/M8cyLtAoeq,miaminewsnow,59516314,,,Sun Dec 09 07:10:03 +0000 2018
413,Video Captures Emotional Reunion At Miami Beach School http://dlvr.it/Qt6q1c pic.twitter.com/PR8woRzMgN,miaminewsnow,59516314,,,Sat Dec 08 06:41:04 +0000 2018
414,Amazing Work Of Alexander Mijares On Display At Art Basel http://dlvr.it/Qt1dFk pic.twitter.com/JBWOG7GF0b,miaminewsnow,59516314,,,Fri Dec 07 00:31:03 +0000 2018
415,"Bah, Humbug: Florida Neighbors Angry Over Woman’s Christmas Light Display http://dlvr.it/Qt15Cx pic.twitter.com/vGeU2ewxEu",miaminewsnow,59516314,,,Thu Dec 06 21:27:06 +0000 2018
416,Surveillance Video Shows Man Discharging Firearm During Convenience Store Robbery http://dlvr.it/Qt0QFD pic.twitter.com/4zTh4zCS0W,miaminewsnow,59516314,,,Thu Dec 06 18:22:45 +0000 2018
417,Nation Bids Final Farewell To George H.W. Bush In Washington http://dlvr.it/Qsx1JX pic.twitter.com/jzZglAePmg,miaminewsnow,59516314,,,Thu Dec 06 00:24:03 +0000 2018
418,Art Basel Miami Beach Kicks Off With VIP Preview http://dlvr.it/QswTkR pic.twitter.com/yr2Cee8D4o,miaminewsnow,59516314,,,Wed Dec 05 21:22:05 +0000 2018
419,‘Rudolph’ Actress Defends Christmas Classic Against Bullying Claims http://dlvr.it/Qsvm4G pic.twitter.com/gmfFSHgYx9,miaminewsnow,59516314,,,Wed Dec 05 18:19:06 +0000 2018
420,Miami T-Mobile Store Hit By “Smash & Grab” Burglars http://dlvr.it/QsqsTN pic.twitter.com/BnsDzTTCy3,miaminewsnow,59516314,,,Tue Dec 04 21:22:05 +0000 2018
421,High School Could Be Renamed To Honor Couple Who Fought Interracial Marriage Ban http://dlvr.it/Qsq9wJ pic.twitter.com/W4LnxCoOj7,miaminewsnow,59516314,,,Tue Dec 04 18:19:05 +0000 2018
422,Man Attacked By Gator In Retirement Community http://dlvr.it/QspNCm pic.twitter.com/MFXQPaPzSv,miaminewsnow,59516314,,,Tue Dec 04 15:12:32 +0000 2018
423,4 Days Of Events To Honor Former President George H.W. Bush http://dlvr.it/Qsl51y pic.twitter.com/iTGV89qVCb,miaminewsnow,59516314,,,Mon Dec 03 20:45:04 +0000 2018
424,Memorial Service Held For Miami Beach Police Detective http://dlvr.it/QskMv8 pic.twitter.com/1SWgM2kw7G,miaminewsnow,59516314,,,Mon Dec 03 17:42:04 +0000 2018
425,Facing South Florida: Nikki Fried Now The Face Of Democratic Party http://dlvr.it/Qsf57c pic.twitter.com/16gjxBm40a,miaminewsnow,59516314,,,Sun Dec 02 17:09:03 +0000 2018
426,"George H.W. Bush, 41st president, dies at 94 http://dlvr.it/QsYBBp pic.twitter.com/Xr7ki3TrJT",miaminewsnow,59516314,,,Sat Dec 01 07:18:05 +0000 2018
427,CBS4 Wants To Send You To Universal Orlando Resort™ http://dlvr.it/QsSCKq pic.twitter.com/U4vg8OWn1i,miaminewsnow,59516314,,,Fri Nov 30 03:52:02 +0000 2018
428,SUV Plows Into Lauderdale Lakes Furniture Store http://dlvr.it/QsRH0j pic.twitter.com/fh6d6hlbdS,miaminewsnow,59516314,,,Thu Nov 29 21:47:03 +0000 2018
429,Jim Berry’s Peach n’ Berry Cobbler http://dlvr.it/QsQcbw pic.twitter.com/gepQPlXbE9,miaminewsnow,59516314,,,Thu Nov 29 18:44:06 +0000 2018
430,Woman Begs For Return Of Stolen Yorkie From Miami Gas Station http://dlvr.it/QsMBlD pic.twitter.com/EHCJgxdr5m,miaminewsnow,59516314,,,Thu Nov 29 00:49:32 +0000 2018
431,BSO: Woman Caught On Surveillance Camera Stealing From Assisted Living Facility Resident http://dlvr.it/QsLgHf pic.twitter.com/TOlJGp5hN0,miaminewsnow,59516314,,,Wed Nov 28 21:45:03 +0000 2018
432,Hollywood Police Search For Man Accused Of Soliciting Girl For Sex http://dlvr.it/QsL0JN pic.twitter.com/b0jIanMQaX,miaminewsnow,59516314,,,Wed Nov 28 18:40:05 +0000 2018
433,12-Year-Old Boy Injured In Lauderdale Lakes Shooting http://dlvr.it/QsGdTq pic.twitter.com/AhLrVZdF8R,miaminewsnow,59516314,,,Wed Nov 28 00:43:05 +0000 2018
434,"Police: Fake Uber Driver Steals Rider’s Credit Cards, Runs Up Bill At Walmart http://dlvr.it/QsG5s5 pic.twitter.com/MWvKY59f2c",miaminewsnow,59516314,,,Tue Nov 27 21:40:04 +0000 2018
435,"Hollywood Police Seek Woman Accused Of Robbing Man Of Jewelry, Cash http://dlvr.it/QsFRwk pic.twitter.com/AIEOuPHnSL",miaminewsnow,59516314,,,Tue Nov 27 18:37:04 +0000 2018
436,Busiest U.S.-Mexico Border Crossing Reopens After Violent Clashes http://dlvr.it/Qs9VCF pic.twitter.com/SwI3VLsrEw,miaminewsnow,59516314,,,Mon Nov 26 21:10:05 +0000 2018
437,Man Shot After Fight Breaks Out On Broward County Bus http://dlvr.it/Qs44jN pic.twitter.com/PIKwpXgyxe,miaminewsnow,59516314,,,Sun Nov 25 14:39:04 +0000 2018
438,Fans Going Crazy Over New Disney “Lion King” Trailer http://dlvr.it/QrxlWL pic.twitter.com/5660sOOURu,miaminewsnow,59516314,,,Fri Nov 23 16:41:04 +0000 2018
439,NBA Legend Shaquille O’Neal Working As Broward Sheriff’s Deputy On Thanksgiving http://dlvr.it/Qrv6Qz pic.twitter.com/bTeodgh0IT,miaminewsnow,59516314,,,Fri Nov 23 01:23:05 +0000 2018
440,Expect Warm Conditions With Possible Showers For The Thanksgiving Holiday http://dlvr.it/QrkKXp pic.twitter.com/IfQi2TVneB,miaminewsnow,59516314,,,Wed Nov 21 00:24:05 +0000 2018
441,"Instagram Cracking Down On Fake Likes, Comments, Follows http://dlvr.it/Qrjnrl pic.twitter.com/GpTAJs7FCh",miaminewsnow,59516314,,,Tue Nov 20 21:21:05 +0000 2018
442,Marilu Henner Guest Stars On An All-New Episode Of ‘The Neighborhood’ http://dlvr.it/QrdNw7 pic.twitter.com/yYp8GOICw9,miaminewsnow,59516314,,,Mon Nov 19 21:15:06 +0000 2018
443,"Students At Cardinal Gibbons High Fall Ill, Hospitalized http://dlvr.it/QrcWQM pic.twitter.com/D1pTa1Y5G1",miaminewsnow,59516314,,,Mon Nov 19 18:13:05 +0000 2018
444,FIU Dep. Police Chief Charged With Battery On Police Officer http://dlvr.it/QrblwH pic.twitter.com/moppjqDrot,miaminewsnow,59516314,,,Mon Nov 19 15:09:33 +0000 2018
445,‘Give Miami Day’ Celebrates Record Setting Donations http://dlvr.it/QrRL4Z pic.twitter.com/U8NwKhM6m7,miaminewsnow,59516314,,,Fri Nov 16 22:41:05 +0000 2018
446,Study: Most Would Skip Gift Exchanges If Family Agreed http://dlvr.it/QrQn11 pic.twitter.com/Ft5zzAidXY,miaminewsnow,59516314,,,Fri Nov 16 19:33:33 +0000 2018
447,California Gov. Brown To Tour Region Scorched By Woolsey Fire http://dlvr.it/QrLnmt pic.twitter.com/h4HycTqvmb,miaminewsnow,59516314,,,Thu Nov 15 22:08:03 +0000 2018
448,‘Give Miami Day’ Offers You The Chance To Help Your Community http://dlvr.it/QrL911 pic.twitter.com/tVLRHzUfos,miaminewsnow,59516314,,,Thu Nov 15 19:02:33 +0000 2018
